title	author	ave_rating	no_rating	link
Kafka on the Shore	Haruki Murakami	4.13	362,370	https://www.goodreads.com/book/show/4929.Kafka_on_the_Shore
Love & Freedom	Sue Moorcroft	3.95	315	https://www.goodreads.com/book/show/10701350-love-freedom
Wrong Number: An Erotic Paranormal Mystery Special	Sandra Ross	2.71	7	https://www.goodreads.com/book/show/17373825-wrong-number
The Beat of His Wings and Other Heart Sounds	Beth Gualda	4.00	7	https://www.goodreads.com/book/show/16099984-the-beat-of-his-wings-and-other-heart-sounds
All Spell Breaks Loose (Raine Benares, #6)	Lisa Shearin	4.14	2,394	https://www.goodreads.com/book/show/13074442-all-spell-breaks-loose
Resenting the Hero (Hero, #1)	Moira J. Moore	3.59	5,103	https://www.goodreads.com/book/show/987507.Resenting_the_Hero
Great Hexpectations (Dulcie O'Neil, #3)	H.P. Mallory	4.15	4,994	https://www.goodreads.com/book/show/12977456-great-hexpectations
Into the Woods	M.L. Rhodes	3.72	461	https://www.goodreads.com/book/show/9023245-into-the-woods
Goddess (Starcrossed, #3)	Josephine Angelini	4.22	30,302	https://www.goodreads.com/book/show/7849034-goddess
Branded (Fall of Angels, #1)	Keary Taylor	3.71	16,645	https://www.goodreads.com/book/show/7862725-branded
Witch Song (Witch Song, #1)	Amber Argyle	3.68	5,381	https://www.goodreads.com/book/show/10400575-witch-song
Feral Craving (Justice Demon, #1)	D.C. Stone	4.12	24	https://www.goodreads.com/book/show/17307067-feral-craving
Existence (Lynnie Russell Trilogy, #2)	R.M. Gilmore	4.62	24	https://www.goodreads.com/book/show/22013235-existence
Wanted (Most Wanted, #1)	J. Kenner	3.92	14,253	https://www.goodreads.com/book/show/18142413-wanted
No Words Alone (Spark, #2)	Autumn Dawn	3.73	1,241	https://www.goodreads.com/book/show/3931196-no-words-alone
Modern Serpents Talk Things Through	Jamie Brindle	3.34	92	https://www.goodreads.com/book/show/18680468-modern-serpents-talk-things-through
Micah's Calling (All The King's Men, #3)	Donya Lynne	4.25	747	https://www.goodreads.com/book/show/15822808-micah-s-calling
Wolf Claim (Wolves of Willow Bend, #3)	Heather Long	3.98	459	https://www.goodreads.com/book/show/23129667-wolf-claim
Azagoth (Demonica Underworld, #1; Lords of Deliverance, #5.5; Demonica, #11)	Larissa Ione	4.33	4,777	https://www.goodreads.com/book/show/19265916-azagoth
The Winter King (The Warlord Chronicles #1)	Bernard Cornwell	4.25	41,351	https://www.goodreads.com/book/show/18885916-the-winter-king
Stifled (Summoned, #2)	Rainy Kaye	3.98	80	https://www.goodreads.com/book/show/20837412-stifled
Shadow and Bone & Siege and Storm (The Shadow and Bone Trilogy, #1-2)	Leigh Bardugo	4.28	3,387	https://www.goodreads.com/book/show/18217960-shadow-and-bone-siege-and-storm
Shapechangers (Chronicles of the Cheysuli #1)	Jennifer Roberson	3.92	3,870	https://www.goodreads.com/book/show/1046558.Shapechangers
The Blacksmith's Son (Mageborn, #1)	Michael G. Manning	3.90	12,350	https://www.goodreads.com/book/show/11968600-the-blacksmith-s-son
Fate Book (Fate Book, #1)	Mimi Jean Pamfiloff	3.85	3,018	https://www.goodreads.com/book/show/18302758-fate-book
Glamour Blade	Aine P. Massie	5.00	1	https://www.goodreads.com/book/show/25565614-glamour-blade
Laird Wolf (Takhini Shifters #2)	Vivian Arend	4.00	688	https://www.goodreads.com/book/show/25749461-laird-wolf
Zombie Apocalypse Trilogy: (Books 1-3)	Chelsea Luna	4.46	13	https://www.goodreads.com/book/show/25655033-zombie-apocalypse-trilogy
Blood of The Sorceress (The Portal, #3)	Maggie Shayne	4.01	408	https://www.goodreads.com/book/show/15783725-blood-of-the-sorceress
Fractures of Betrayal (Darkest Faerie Tale, #3)	Riley Bancroft	4.53	19	https://www.goodreads.com/book/show/24675462-fractures-of-betrayal
The Awakening (Immortals, #3)	Joy Nash	4.11	1,888	https://www.goodreads.com/book/show/625648.The_Awakening
Surrendering (Regent Vampire Lords, #1)	K.L. Kreig	3.94	1,320	https://www.goodreads.com/book/show/24329784-surrendering
Desert Moon (The Wolves of Twin Moon Ranch, #1)	Anna Lowe	3.95	1,055	https://www.goodreads.com/book/show/25066650-desert-moon
A Roman Holiday (Art Historian Superhero Series, #3)	Rebecca Branch	4.52	21	https://www.goodreads.com/book/show/26069808-a-roman-holiday
The Beast (Black Dagger Brotherhood, #14)	J.R. Ward	4.39	32,338	https://www.goodreads.com/book/show/25293695-the-beast
Everneath (Everneath, #1)	Brodi Ashton	3.74	51,187	https://www.goodreads.com/book/show/9413044-everneath
Trapped in Your Storm (The Village, #3)	Darien Cox	4.34	238	https://www.goodreads.com/book/show/32676415-trapped-in-your-storm
Keystone (Crossbreed #1)	Dannika Dark	4.07	11,216	https://www.goodreads.com/book/show/29079130-keystone
Tempting Fate (The Immortal Descendants, #2)	April White	4.34	2,244	https://www.goodreads.com/book/show/27405987-tempting-fate
The Siren (The Soul Summoner, #2)	Elicia Hyder	4.23	3,666	https://www.goodreads.com/book/show/29492903-the-siren
Spellbound (Immortal Love, #3)	Anna Santos	4.24	387	https://www.goodreads.com/book/show/32891349-spellbound
Sky Pirates (The Chronicles of Light and Shadow, #3)	Liesel Schwarz	3.71	268	https://www.goodreads.com/book/show/17834896-sky-pirates
Forbidden Fate (Sisters of Danu #1)	Mia Pride	4.28	83	https://www.goodreads.com/book/show/32868647-forbidden-fate
Truthwitch (The Witchlands, #1)	Susan Dennard	3.83	54,853	https://www.goodreads.com/book/show/21414439-truthwitch
Quest of the Dreamwalker (The Corthan Legacy Book 1)	Stacy Bennett	4.41	71	https://www.goodreads.com/book/show/32500941-quest-of-the-dreamwalker
A Mate for York (The Program, #1)	Charlene Hartnady	3.95	4,070	https://www.goodreads.com/book/show/26116818-a-mate-for-york
Kiss of a Dragon (Fallen Immortals #1)	Alisa Woods	3.89	4,097	https://www.goodreads.com/book/show/30835829-kiss-of-a-dragon
The Gladiators' Woman (Warriors of Rome #2)	Lacey Carter Andersen	3.25	24	https://www.goodreads.com/book/show/36331213-the-gladiators-woman
Demonviskaren (Alvblodstrilogin, #2)	Lovisa Wistrand	3.94	67	https://www.goodreads.com/book/show/39730552-demonviskaren
Draven (Sons of Sangue, #4.5)	Patricia A. Rasey	4.42	268	https://www.goodreads.com/book/show/32580502-draven
Dark Alpha's Hunger (Reaper, #6)	Donna Grant	4.43	828	https://www.goodreads.com/book/show/39940311-dark-alpha-s-hunger
The Pawn	Catherine Banks	3.94	17	https://www.goodreads.com/book/show/41224428-the-pawn
V Games: Fresh From The Grave (The Vampire Games Trilogy, #2)	Caroline Peckham	4.29	1,089	https://www.goodreads.com/book/show/36515367-v-games
Light Mage (The Black Witch Chronicles, #1.5)	Laurie Forest	4.28	2,965	https://www.goodreads.com/book/show/36631066-light-mage
Spark (Elemental, #2)	Brigid Kemmerer	4.14	16,793	https://www.goodreads.com/book/show/12977172-spark
Flame (Dark Kings #17)	Donna Grant	4.50	1,039	https://www.goodreads.com/book/show/53109166-flame
Curses and Crowns	Heather Marie Adkins	4.28	25	https://www.goodreads.com/book/show/50149988-curses-and-crowns
Twilight Fall (Darkyn #6)	Lynn Viehl	4.06	2,580	https://www.goodreads.com/book/show/2433779.Twilight_Fall
Hidden Magic: The Eldritch of Hallows	Elana McDougall	4.92	12	https://www.goodreads.com/book/show/53623217-hidden-magic
Queen of Swords (The Banished Gods, #1)	L.A. McGinnis	3.97	135	https://www.goodreads.com/book/show/50100269-queen-of-swords
A Court of Wings and Ruin (A Court of Thorns and Roses, #3)	Sarah J. Maas	4.41	445,679	https://www.goodreads.com/book/show/50659472-a-court-of-wings-and-ruin
A Touch of Darkness (Hades & Persephone, #1)	Scarlett St. Clair	3.86	66,568	https://www.goodreads.com/book/show/43175155-a-touch-of-darkness
Chosen at Nightfall (Shadow Falls, #5)	C.C. Hunter	4.34	31,017	https://www.goodreads.com/book/show/15745371-chosen-at-nightfall
Heart Thief (Celta's Heartmates, #2)	Robin D. Owens	4.12	2,294	https://www.goodreads.com/book/show/819060.Heart_Thief
Dreams and Desires	Marci Baun	3.79	252	https://www.goodreads.com/book/show/6987426-dreams-and-desires
Legends: Hunters and Heroes	Shiloh Walker	3.95	129	https://www.goodreads.com/book/show/207155.Legends
On Writing: A Memoir of the Craft	Stephen King	4.31	250,783	https://www.goodreads.com/book/show/10569.On_Writing
Odd Thomas (Odd Thomas, #1)	Dean Koontz	3.96	268,134	https://www.goodreads.com/book/show/14995.Odd_Thomas
Strange Little Band: Two psychics. One mega-corp. All-around bad behavior.	Nancy Brauer	3.68	87	https://www.goodreads.com/book/show/9659252-strange-little-band
To Love a Vampire (Guardian of the Night, #2)	Jody Offen	4.31	452	https://www.goodreads.com/book/show/697409.To_Love_a_Vampire
Hot Pursuit (Troubleshooters, #15)	Suzanne Brockmann	4.21	5,795	https://www.goodreads.com/book/show/5571541-hot-pursuit
Dark Surrender	Mercy Walker	3.48	73	https://www.goodreads.com/book/show/13565779-dark-surrender
Blood and Kisses	Karin Shah	3.80	96	https://www.goodreads.com/book/show/13158635-blood-and-kisses
Nocturnal (The Noctalis Chronicles, #1)	Chelsea M. Cameron	3.80	696	https://www.goodreads.com/book/show/13483201-nocturnal
Destiny's Fire (Kythan Guardians, #1)	Trisha Wolfe	3.88	1,540	https://www.goodreads.com/book/show/13552977-destiny-s-fire
Chains of Fire (The Chosen Ones #4)	Christina Dodd	4.11	2,512	https://www.goodreads.com/book/show/7150757-chains-of-fire
Blood of the White Witch (Of Witches and Warlocks, #3)	Lacey Weatherford	4.18	1,704	https://www.goodreads.com/book/show/8730060-blood-of-the-white-witch
Froi of the Exiles (Lumatere Chronicles, #2)	Melina Marchetta	4.29	16,750	https://www.goodreads.com/book/show/10165727-froi-of-the-exiles
Michael & Shyne (The Wolf's Mate, #4)	R.E. Butler	4.14	1,681	https://www.goodreads.com/book/show/16082057-michael-shyne
The Soul's Mark: FOUND (The Soul's Mark, #1)	Ashley Stoyanoff	3.65	2,357	https://www.goodreads.com/book/show/15758984-the-soul-s-mark
The Woman in White	Wilkie Collins	3.99	144,904	https://www.goodreads.com/book/show/5890.The_Woman_in_White
Devil's Lullaby (Ringer’s Masquerade, #1)	Sarah J. Pepper	4.50	42	https://www.goodreads.com/book/show/13572587-devil-s-lullaby
Untouched: a Murder Mystery and Erotic Love Story	Sandra Ross	4.50	2	https://www.goodreads.com/book/show/17375864-untouched
Wuthering Frights (Dulcie O'Neil, #4)	H.P. Mallory	4.18	4,136	https://www.goodreads.com/book/show/13629951-wuthering-frights
For Whom The Spell Tolls (Dulcie O'Neil, #6)	H.P. Mallory	4.18	2,762	https://www.goodreads.com/book/show/17229475-for-whom-the-spell-tolls
Falling	M.L. Rhodes	3.85	999	https://www.goodreads.com/book/show/157876.Falling
Personal Demons (Personal Demons, #1)	Lisa Desrochers	3.66	10,136	https://www.goodreads.com/book/show/7823600-personal-demons
Witch Born (Witch Song, #2)	Amber Argyle	4.17	1,278	https://www.goodreads.com/book/show/13496452-witch-born
Phase Two: Evaluate (Territory of the Dead, #2)	Rose Wynters	4.13	54	https://www.goodreads.com/book/show/22083883-phase-two
Reluctantly Undead (Reluctantly Undead, #1)	Rayne Rachels	4.33	9	https://www.goodreads.com/book/show/22295330-reluctantly-undead
Gretel: A Fairytale Retold	Niamh Murphy	3.83	421	https://www.goodreads.com/book/show/18164068-gretel
Destino Celestial	Mariza Martins	3.24	17	https://www.goodreads.com/book/show/18966617-destino-celestial
Dead Things (Eric Carter #1)	Stephen Blackmoore	3.80	3,992	https://www.goodreads.com/book/show/15784263-dead-things
The Witch With No Name (The Hollows, #13)	Kim Harrison	4.44	23,029	https://www.goodreads.com/book/show/20426917-the-witch-with-no-name
Chained by Night (MoonBound Clan Vampire, #2)	Larissa Ione	4.21	4,726	https://www.goodreads.com/book/show/15803815-chained-by-night
Excalibur: A Novel of Arthur	Bernard Cornwell	4.37	23,791	https://www.goodreads.com/book/show/13613945-excalibur
Allegiance (Penton Legacy, #4)	Susannah Sandlin	4.06	867	https://www.goodreads.com/book/show/20524616-allegiance
The Forever Girl (Forever Girl, #1)	Rebecca Hamilton	3.61	2,299	https://www.goodreads.com/book/show/21428915-the-forever-girl
Zero Sum (Zero Sight, #2)	B. Justin Shier	4.14	4,805	https://www.goodreads.com/book/show/13101795-zero-sum
Accidentally...Evil? (Accidentally Yours, #3.5)	Mimi Jean Pamfiloff	4.16	1,666	https://www.goodreads.com/book/show/17557575-accidentally-evil
Blood's Voice	Aine P. Massie	3.52	50	https://www.goodreads.com/book/show/19473328-blood-s-voice
Dirty Ink (Wicked Ink Chronicles #4)	Laura Wright	4.20	30	https://www.goodreads.com/book/show/25649929-dirty-ink
Grave Intentions (Grave, #1)	Lori Sjoberg	3.78	772	https://www.goodreads.com/book/show/16134959-grave-intentions
Imperfection of Fate (Darkest Faerie Tale, #4)	Riley Bancroft	4.50	18	https://www.goodreads.com/book/show/25438217-imperfection-of-fate
Celtic Fire (Druids of Avalon, #1)	Joy Nash	3.66	511	https://www.goodreads.com/book/show/1462833.Celtic_Fire
Ice Kissed (Kanin Chronicles, #2)	Amanda Hocking	4.02	9,423	https://www.goodreads.com/book/show/18132923-ice-kissed
Real Vampires Don't Wear Size Six (Glory St. Clair, #7)	Gerry Bartlett	4.18	1,465	https://www.goodreads.com/book/show/9636838-real-vampires-don-t-wear-size-six
Great Caesar's Ghost (Art Historian Super Heroes, #2)	Rebecca Branch	4.71	21	https://www.goodreads.com/book/show/22822113-great-caesar-s-ghost
Dark Instincts (The Phoenix Pack, #4)	Suzanne Wright	4.23	14,274	https://www.goodreads.com/book/show/21901021-dark-instincts
The Hot Zone (Rainshadow, #3; Ghost Hunters, #11)	Jayne Castle	4.22	5,097	https://www.goodreads.com/book/show/20821265-the-hot-zone
Harry Potter and the Cursed Child (Harry Potter, #8)	John Tiffany	3.56	819,434	https://www.goodreads.com/book/show/29058155-harry-potter-and-the-cursed-child
Sweet Venom (Medusa Girls, #1)	Tera Lynn Childs	3.91	12,128	https://www.goodreads.com/book/show/10429067-sweet-venom
Stirring Creatures: Holiday Special (The Village, #3.5)	Darien Cox	4.01	141	https://www.goodreads.com/book/show/33290744-stirring-creatures
Shine (Mageri, #5; Mageriverse #5)	Dannika Dark	4.44	7,214	https://www.goodreads.com/book/show/19548305-shine
The Soul Summoner (The Soul Summoner, #1)	Elicia Hyder	4.12	6,620	https://www.goodreads.com/book/show/27304591-the-soul-summoner
Feversong (Fever, #9)	Karen Marie Moning	4.39	19,710	https://www.goodreads.com/book/show/12446825-feversong
Child of a Hidden Sea (Hidden Sea Tales, #1)	A.M. Dellamonica	3.55	1,389	https://www.goodreads.com/book/show/18490629-child-of-a-hidden-sea
The Mating Season (Werewolves of Montana, #6)	Bonnie Vanak	4.25	134	https://www.goodreads.com/book/show/20588826-the-mating-season
Paladin (Paladin, #1)	Sally Slater	4.01	7,323	https://www.goodreads.com/book/show/25507388-paladin
Asael's Nature (A Series of Angels #3)	Joel Crofoot	4.64	45	https://www.goodreads.com/book/show/35096842-asael-s-nature
Reckless Magic (Demon Reverse Harem #2)	Lacey Carter Andersen	4.20	76	https://www.goodreads.com/book/show/36615067-reckless-magic
Catwoman: Soulstealer	Sarah J. Maas	4.11	19,334	https://www.goodreads.com/book/show/29749098-catwoman
Forever Violet (Tangled Realms #1)	Jessica Sorensen	4.06	1,788	https://www.goodreads.com/book/show/35513821-forever-violet
Tall, Dark & Deadly (Agents of the Bureau, #1)	Kharma Kelley	4.14	80	https://www.goodreads.com/book/show/33873425-tall-dark-deadly
Lovers in Hell	Janet E. Morris	5.00	5	https://www.goodreads.com/book/show/41808739-lovers-in-hell
Reaper of Earth (The Artifact Reaper Saga #1)	Jen L. Grey	3.91	178	https://www.goodreads.com/book/show/41591694-reaper-of-earth
V Games: Dead Before Dawn (The Vampire Games Trilogy, #3)	Caroline Peckham	4.33	703	https://www.goodreads.com/book/show/40040199-v-games
A Kingdom of Nomads (Outcast, #2)	S.B. Nova	4.18	84	https://www.goodreads.com/book/show/41437147-a-kingdom-of-nomads
The Iron Flower (The Black Witch Chronicles, #2)	Laurie Forest	4.37	11,756	https://www.goodreads.com/book/show/35750305-the-iron-flower
Elemental (Elemental, #0.5)	Brigid Kemmerer	3.80	6,097	https://www.goodreads.com/book/show/13418864-elemental
The Fiery Crown (Forgotten Empires, #2)	Jeffe Kennedy	4.06	555	https://www.goodreads.com/book/show/43711130-the-fiery-crown
Silent Lucidity (The Infinite City, #1)	Tiffany Roberts	3.85	2,337	https://www.goodreads.com/book/show/45445801-silent-lucidity
Wolf's Bane (Moon Marked, #1)	Aimee Easterling	3.72	1,741	https://www.goodreads.com/book/show/40396472-wolf-s-bane
A Knight to Remember (Merriweather Sisters #1; Knights Through Time Travel #1)	Cynthia Luhrs	3.80	1,596	https://www.goodreads.com/book/show/26860745-a-knight-to-remember
Sentinals Awaken (Sentinals #1)	Helen Garraway	4.69	51	https://www.goodreads.com/book/show/55519316-sentinals-awaken
Betrayed by Blood: The Shelton Family Legacy : 1	L.A. McGinnis	4.23	26	https://www.goodreads.com/book/show/57586511-betrayed-by-blood
A Court of Frost and Starlight (A Court of Thorns and Roses, #3.1)	Sarah J. Maas	3.81	277,601	https://www.goodreads.com/book/show/53119239-a-court-of-frost-and-starlight
Conversations with God: An Uncommon Dialogue, Book 1	Neale Donald Walsch	4.16	34,044	https://www.goodreads.com/book/show/15015.Conversations_with_God
Bloodhound (Beka Cooper, #2)	Tamora Pierce	4.28	36,283	https://www.goodreads.com/book/show/153779.Bloodhound
Hunter's Edge	Shiloh Walker	3.87	326	https://www.goodreads.com/book/show/4138118-hunter-s-edge
The Light of Asteria: Kailmeyra's Last Hope (Kailmeyra, #1)	Elizabeth Isaacs	3.91	993	https://www.goodreads.com/book/show/8893687-the-light-of-asteria
Garden of Stones (Guardian of the Night, #1)	Jody Offen	3.89	875	https://www.goodreads.com/book/show/342309.Garden_of_Stones
The Bastard Prince (Kria, #3)	Megan Derr	4.01	1,046	https://www.goodreads.com/book/show/7903473-the-bastard-prince
Moonlight (Dark Guardian, #1)	Rachel Hawthorne	3.80	12,633	https://www.goodreads.com/book/show/3567200-moonlight
Never Let Me Go	Kazuo Ishiguro	3.83	550,746	https://www.goodreads.com/book/show/6334.Never_Let_Me_Go
The Secrets on Forest Bend	Susan C. Muller	4.06	108	https://www.goodreads.com/book/show/13186939-the-secrets-on-forest-bend
Lacrimosa (Requiem, #1)	Christine Fonseca	3.46	545	https://www.goodreads.com/book/show/13250486-lacrimosa
Chains of Ice (The Chosen Ones #3)	Christina Dodd	4.07	2,832	https://www.goodreads.com/book/show/7150756-chains-of-ice
The Demon Kiss (Of Witches and Warlocks, #2)	Lacey Weatherford	4.10	2,055	https://www.goodreads.com/book/show/8077372-the-demon-kiss
Starting Over	Sue Moorcroft	3.97	859	https://www.goodreads.com/book/show/7058362-starting-over
Steinernes Fleisch (Reckless, #1)	Cornelia Funke	3.74	18,661	https://www.goodreads.com/book/show/7894237-steinernes-fleisch
When Darkness Comes	Sandra Ross	5.00	1	https://www.goodreads.com/book/show/17375870-when-darkness-comes
Malice In Wonderland (Dulcie O'Neil, #5)	H.P. Mallory	4.07	3,172	https://www.goodreads.com/book/show/15961954-malice-in-wonderland
Jasmyn	Alex Bell	3.80	469	https://www.goodreads.com/book/show/5886011-jasmyn
Unacceptable Risk (Hidden Wolves, #1)	Kaje Harper	3.91	1,819	https://www.goodreads.com/book/show/12743591-unacceptable-risk
Léopold’s Wicked Embrace (Immortals of New Orleans, #5)	Kym Grosso	4.45	2,430	https://www.goodreads.com/book/show/21844932-l-opold-s-wicked-embrace
Cybele's Secret (Wildwood, #2)	Juliet Marillier	4.09	12,268	https://www.goodreads.com/book/show/963508.Cybele_s_Secret
The Mad, Bad Duke (Nvengaria, #2)	Jennifer Ashley	3.99	1,660	https://www.goodreads.com/book/show/768525.The_Mad_Bad_Duke
Living Words	Sasha L. Miller	3.79	379	https://www.goodreads.com/book/show/8017033-living-words
Black Arts (Jane Yellowrock, #7)	Faith Hunter	4.36	11,514	https://www.goodreads.com/book/show/17566969-black-arts
Her Forbidden Alpha (Colliding Worlds, #2)	Tabitha Conall	4.22	189	https://www.goodreads.com/book/show/22944403-her-forbidden-alpha
Stormrise (Storm Chronicles #1)	Skye Knizley	3.70	1,321	https://www.goodreads.com/book/show/18686477-stormrise
The Were, The Witch and The Baby	Virginia Nelson	4.00	10	https://www.goodreads.com/book/show/23247330-the-were-the-witch-and-the-baby
Gameboard of the Gods (Age of X, #1)	Richelle Mead	3.95	16,421	https://www.goodreads.com/book/show/13477883-gameboard-of-the-gods
The Vampire's House of Pleasure Part 1 (The Vampire's House of Pleasure #1)	Rose Wynters	3.92	36	https://www.goodreads.com/book/show/25153362-the-vampire-s-house-of-pleasure-part-1
Enemy of God (The Warlord Chronicles, #2)	Bernard Cornwell	4.36	21,653	https://www.goodreads.com/book/show/13553133-enemy-of-god
Storm Force (Omega Force, #1)	Susannah Sandlin	3.82	581	https://www.goodreads.com/book/show/17394680-storm-force
Suffer (Slave to the Coven, #1)	Kim Faulks	3.25	48	https://www.goodreads.com/book/show/22435997-suffer
Carnal Secrets (The Phoenix Pack, #3)	Suzanne Wright	4.02	17,365	https://www.goodreads.com/book/show/17853851-carnal-secrets
Zero Sight (Zero Sight, #1)	B. Justin Shier	4.02	5,634	https://www.goodreads.com/book/show/11012966-zero-sight
Savage Chains: Captured (#1)	Caris Roane	3.83	154	https://www.goodreads.com/book/show/19893676-savage-chains
Stolen and Forgiven (Branded Packs, #1)	Carrie Ann Ryan	3.79	1,542	https://www.goodreads.com/book/show/23643952-stolen-and-forgiven
Beautiful Danger (In the Company of Vampires #1)	Michele Hauf	3.70	178	https://www.goodreads.com/book/show/17233619-beautiful-danger
Arrows of Desire (Even Gods Fall in Love, #3)	Lynne Connolly	3.71	17	https://www.goodreads.com/book/show/24963588-arrows-of-desire
Magonia (Magonia, #1)	Maria Dahvana Headley	3.54	17,918	https://www.goodreads.com/book/show/21393526-magonia
Vampires Prefer Blondes (Psy-Vamp #3)	Cassandra Lawson	4.32	63	https://www.goodreads.com/book/show/22391913-vampires-prefer-blondes
How to Run with a Naked Werewolf (Naked Werewolf, #3)	Molly Harper	4.15	6,387	https://www.goodreads.com/book/show/17339558-how-to-run-with-a-naked-werewolf
Gravity (Mageri, #4; Mageriverse #4)	Dannika Dark	4.37	8,130	https://www.goodreads.com/book/show/13571899-gravity
A Daughter of No Nation (Hidden Sea Tales, #2)	A.M. Dellamonica	3.87	489	https://www.goodreads.com/book/show/23847967-a-daughter-of-no-nation
The Mating Challenge (Werewolves of Montana, #5)	Bonnie Vanak	4.08	265	https://www.goodreads.com/book/show/20588815-the-mating-challenge
The Demon King (Seven Realms, #1)	Cinda Williams Chima	4.11	78,567	https://www.goodreads.com/book/show/6342491-the-demon-king
Ramatel's Vow (A Series of Angels #2)	Joel Crofoot	4.61	77	https://www.goodreads.com/book/show/33241689-ramatel-s-vow
Dragon Beginning (Stolen Mates, #0)	Lacey Carter Andersen	3.78	9	https://www.goodreads.com/book/show/36186582-dragon-beginning
Awaken the Darkness (Immortal Guardians #8)	Dianne Duvall	4.41	2,707	https://www.goodreads.com/book/show/40043924-awaken-the-darkness
Spinning Silver	Naomi Novik	4.20	97,894	https://www.goodreads.com/book/show/36896898-spinning-silver
The Captive King (Royal States, #3)	Susan Copperfield	4.26	611	https://www.goodreads.com/book/show/38331030-the-captive-king
Fantasy of Frost (The Tainted Accords, #1)	Kelly St. Clare	4.18	10,661	https://www.goodreads.com/book/show/35082746-fantasy-of-frost
Bound to the Battle God (Aspect and Anchor #1)	Ruby Dixon	4.32	6,046	https://www.goodreads.com/book/show/50841330-bound-to-the-battle-god
Storm (Elemental, #1)	Brigid Kemmerer	3.95	25,885	https://www.goodreads.com/book/show/10401084-storm
Hypnos (Seeking the Zodiacs #1)	R.J. Blain	4.44	579	https://www.goodreads.com/book/show/43729441-hypnos
Kingdom of the Wicked (Kingdom of the Wicked, #1)	Kerri Maniscalco	4.01	72,559	https://www.goodreads.com/book/show/52735921-kingdom-of-the-wicked
The Becoming (The Dragon Heart Legacy #2)	Nora Roberts	4.56	3,070	https://www.goodreads.com/book/show/56349775-the-becoming
Devil's Cut	L.A. McGinnis	4.31	118	https://www.goodreads.com/book/show/56590084-devil-s-cut
He Loves Me, He Loves Me Hot (Immortally Sexy, #3)	Stephanie Rowe	3.97	1,089	https://www.goodreads.com/book/show/792152.He_Loves_Me_He_Loves_Me_Hot
Heart Duel (Celta's Heartmates, #3)	Robin D. Owens	4.13	1,970	https://www.goodreads.com/book/show/515121.Heart_Duel
Hunter's Need (Hunters, #12)	Shiloh Walker	4.03	432	https://www.goodreads.com/book/show/6353999-hunter-s-need
Dragons of Autumn Twilight (Dragonlance: Chronicles, #1)	Margaret Weis	3.99	114,436	https://www.goodreads.com/book/show/259836.Dragons_of_Autumn_Twilight
Warrior (The Blades of the Rose, #1)	Zoe Archer	3.38	2,576	https://www.goodreads.com/book/show/7199027-warrior
The Road to Avalon (Dark Ages of Britain, #1)	Joan Wolf	4.02	1,684	https://www.goodreads.com/book/show/692969.The_Road_to_Avalon
Paradox	Rosemary Laurey	3.27	162	https://www.goodreads.com/book/show/1074788.Paradox
Ironside (Modern Faerie Tales, #3)	Holly Black	4.02	38,408	https://www.goodreads.com/book/show/283494.Ironside
Reluctant Guardian	Kristy K. James	3.74	127	https://www.goodreads.com/book/show/12082095-reluctant-guardian
Along for the Ride	Sarah Dessen	4.05	195,193	https://www.goodreads.com/book/show/5664985-along-for-the-ride
State of Wonder	Ann Patchett	3.88	174,550	https://www.goodreads.com/book/show/9118135-state-of-wonder
Hit the Road Jack (Vamp Chronicles, #3)	Christin Lovell	4.34	774	https://www.goodreads.com/book/show/13183125-hit-the-road-jack
Haven (The Willows, #1)	Hope Collier	3.76	484	https://www.goodreads.com/book/show/12626444-haven
Storm of Shadows (The Chosen Ones, #2)	Christina Dodd	4.03	3,327	https://www.goodreads.com/book/show/6345977-storm-of-shadows
Magician (The Riftwar Saga, #1-2)	Raymond E. Feist	4.27	66,598	https://www.goodreads.com/book/show/43916.Magician
Want to Know a Secret?	Sue Moorcroft	3.83	441	https://www.goodreads.com/book/show/8713636-want-to-know-a-secret
The Unwilling (The Children of Lilith, Volume 1)	C. David Belt	4.16	38	https://www.goodreads.com/book/show/12903325-the-unwilling
The Darkness' Kiss	Sandra Ross	3.00	2	https://www.goodreads.com/book/show/17375854-the-darkness-kiss
Unexpected Demands (Hidden Wolves, #2)	Kaje Harper	3.93	1,115	https://www.goodreads.com/book/show/13420202-unexpected-demands
The 5th Wave (The 5th Wave, #1)	Rick Yancey	4.02	427,937	https://www.goodreads.com/book/show/16101128-the-5th-wave
