title	author	ave_rating	no_rating	link
City of Bones (The Mortal Instruments, #1)	Cassandra Clare	4.08	1,779,165	https://www.goodreads.com/book/show/256683.City_of_Bones
Moon Called (Mercy Thompson, #1)	Patricia Briggs	4.12	197,592	https://www.goodreads.com/book/show/71811.Moon_Called
Harry Potter and the Sorcerer's Stone (Harry Potter, #1)	J.K. Rowling	4.47	8,050,967	https://www.goodreads.com/book/show/3.Harry_Potter_and_the_Sorcerer_s_Stone
Magic Bites (Kate Daniels, #1)	Ilona Andrews	4.03	118,978	https://www.goodreads.com/book/show/38619.Magic_Bites
Vampire Academy (Vampire Academy, #1)	Richelle Mead	4.10	602,284	https://www.goodreads.com/book/show/345627.Vampire_Academy
Storm Front (The Dresden Files, #1)	Jim Butcher	3.98	324,397	https://www.goodreads.com/book/show/47212.Storm_Front
Neverwhere (London Below, #1)	Neil Gaiman	4.16	471,020	https://www.goodreads.com/book/show/14497.Neverwhere
Dead Until Dark (Sookie Stackhouse, #1)	Charlaine Harris	3.96	523,117	https://www.goodreads.com/book/show/301082.Dead_Until_Dark
Halfway to the Grave (Night Huntress, #1)	Jeaniene Frost	4.12	151,870	https://www.goodreads.com/book/show/1421990.Halfway_to_the_Grave
American Gods (American Gods, #1)	Neil Gaiman	4.10	828,401	https://www.goodreads.com/book/show/30165203-american-gods
The Lightning Thief (Percy Jackson and the Olympians, #1)	Rick Riordan	4.27	2,307,653	https://www.goodreads.com/book/show/28187.The_Lightning_Thief
Dead Witch Walking (The Hollows, #1)	Kim Harrison	4.01	124,159	https://www.goodreads.com/book/show/30264.Dead_Witch_Walking
Darkfever (Fever, #1)	Karen Marie Moning	4.04	176,896	https://www.goodreads.com/book/show/112750.Darkfever
Cry Wolf (Alpha & Omega, #1)	Patricia Briggs	4.11	96,558	https://www.goodreads.com/book/show/2355575.Cry_Wolf
Twilight (The Twilight Saga, #1)	Stephenie Meyer	3.62	5,501,477	https://www.goodreads.com/book/show/41865.Twilight
Clockwork Angel (The Infernal Devices, #1)	Cassandra Clare	4.30	755,828	https://www.goodreads.com/book/show/7171637-clockwork-angel
Bitten (Otherworld, #1)	Kelley Armstrong	4.00	101,860	https://www.goodreads.com/book/show/11918.Bitten
Dark Lover (Black Dagger Brotherhood, #1)	J.R. Ward	4.16	316,701	https://www.goodreads.com/book/show/42899.Dark_Lover
Good Omens: The Nice and Accurate Prophecies of Agnes Nutter, Witch	Terry Pratchett	4.24	616,066	https://www.goodreads.com/book/show/12067.Good_Omens
Guilty Pleasures (Anita Blake, Vampire Hunter, #1)	Laurell K. Hamilton	4.01	141,270	https://www.goodreads.com/book/show/30281.Guilty_Pleasures
Wicked Lovely (Wicked Lovely, #1)	Melissa Marr	3.69	171,344	https://www.goodreads.com/book/show/305234.Wicked_Lovely
Tithe (Modern Faerie Tales, #1)	Holly Black	3.71	92,393	https://www.goodreads.com/book/show/46777.Tithe
Succubus Blues (Georgina Kincaid, #1)	Richelle Mead	3.93	56,565	https://www.goodreads.com/book/show/235718.Succubus_Blues
The Mortal Instruments Boxed Set: City of Bones; City of Ashes; City of Glass (The Mortal Instruments, #1-3)	Cassandra Clare	4.56	66,553	https://www.goodreads.com/book/show/6485421-the-mortal-instruments-boxed-set
Shiver (The Wolves of Mercy Falls, #1)	Maggie Stiefvater	3.76	465,372	https://www.goodreads.com/book/show/6068551-shiver
Hounded (The Iron Druid Chronicles, #1)	Kevin Hearne	4.07	86,300	https://www.goodreads.com/book/show/9533378-hounded
Hush, Hush (Hush, Hush, #1)	Becca Fitzpatrick	3.94	640,728	https://www.goodreads.com/book/show/6339664-hush-hush
The Graveyard Book	Neil Gaiman	4.13	485,762	https://www.goodreads.com/book/show/2213661.The_Graveyard_Book
Fallen (Fallen, #1)	Lauren Kate	3.72	543,783	https://www.goodreads.com/book/show/6487308-fallen
Angels' Blood (Guild Hunter, #1)	Nalini Singh	4.06	86,927	https://www.goodreads.com/book/show/3819326-angels-blood
Some Girls Bite (Chicagoland Vampires, #1)	Chloe Neill	3.98	63,405	https://www.goodreads.com/book/show/4447622-some-girls-bite
Sunshine	Robin McKinley	3.84	41,437	https://www.goodreads.com/book/show/8088.Sunshine
Anansi Boys (American Gods #2)	Neil Gaiman	4.01	211,730	https://www.goodreads.com/book/show/2744.Anansi_Boys
Touch the Dark (Cassandra Palmer, #1)	Karen Chance	3.71	36,686	https://www.goodreads.com/book/show/67513.Touch_the_Dark
Stray (Shifters, #1)	Rachel Vincent	3.77	37,652	https://www.goodreads.com/book/show/793399.Stray
The Summoning (Darkest Powers, #1)	Kelley Armstrong	4.00	172,239	https://www.goodreads.com/book/show/2800905-the-summoning
On the Edge (The Edge, #1)	Ilona Andrews	4.02	42,762	https://www.goodreads.com/book/show/6329547-on-the-edge
Blood and Chocolate	Annette Curtis Klause	3.78	42,075	https://www.goodreads.com/book/show/30324.Blood_and_Chocolate
Skinwalker (Jane Yellowrock, #1)	Faith Hunter	3.91	37,441	https://www.goodreads.com/book/show/5585788-skinwalker
Rosemary and Rue (October Daye, #1)	Seanan McGuire	3.76	36,428	https://www.goodreads.com/book/show/6294549-rosemary-and-rue
Kitty and the Midnight Hour (Kitty Norville #1)	Carrie Vaughn	3.67	33,727	https://www.goodreads.com/book/show/14461.Kitty_and_the_Midnight_Hour
The Iron King (The Iron Fey, #1)	Julie Kagawa	3.88	212,564	https://www.goodreads.com/book/show/6644117-the-iron-king
Storm Born (Dark Swan, #1)	Richelle Mead	3.87	33,336	https://www.goodreads.com/book/show/2754510-storm-born
Acheron (Dark-Hunter, #14)	Sherrilyn Kenyon	4.54	58,495	https://www.goodreads.com/book/show/2299110.Acheron
Night Watch (Watch #1)	Sergei Lukyanenko	3.98	41,062	https://www.goodreads.com/book/show/359375.Night_Watch
Bloodlines (Bloodlines, #1)	Richelle Mead	4.17	184,004	https://www.goodreads.com/book/show/8709527-bloodlines
First Grave on the Right (Charley Davidson, #1)	Darynda Jones	4.00	84,214	https://www.goodreads.com/book/show/8788554-first-grave-on-the-right
Valiant (Modern Faerie Tales #2)	Holly Black	3.86	37,270	https://www.goodreads.com/book/show/266607.Valiant
Marked (House of Night, #1)	P.C. Cast	3.80	466,007	https://www.goodreads.com/book/show/30183.Marked
Written in Red (The Others, #1)	Anne Bishop	4.24	56,009	https://www.goodreads.com/book/show/15711341-written-in-red
A Discovery of Witches (All Souls Trilogy, #1)	Deborah Harkness	4.00	430,231	https://www.goodreads.com/book/show/8667848-a-discovery-of-witches
Daughter of Smoke & Bone (Daughter of Smoke & Bone, #1)	Laini Taylor	3.98	352,455	https://www.goodreads.com/book/show/8490112-daughter-of-smoke-bone
Glass Houses (The Morganville Vampires, #1)	Rachel Caine	3.90	102,199	https://www.goodreads.com/book/show/27266.Glass_Houses
Spider's Bite (Elemental Assassin, #1)	Jennifer Estep	3.87	34,890	https://www.goodreads.com/book/show/6611038-spider-s-bite
Beautiful Creatures (Caster Chronicles, #1)	Kami Garcia	3.76	578,479	https://www.goodreads.com/book/show/6304335-beautiful-creatures
War for the Oaks	Emma Bull	4.01	9,943	https://www.goodreads.com/book/show/70582.War_for_the_Oaks
Grave Witch (Alex Craft, #1)	Kalayna Price	3.93	33,298	https://www.goodreads.com/book/show/7823038-grave-witch
Ironside (Modern Faerie Tales, #3)	Holly Black	4.02	38,408	https://www.goodreads.com/book/show/283494.Ironside
Midnight's Daughter (Dorina Basarab, #1)	Karen Chance	4.00	19,230	https://www.goodreads.com/book/show/3072254-midnight-s-daughter
Ill Wind (Weather Warden, #1)	Rachel Caine	3.73	18,513	https://www.goodreads.com/book/show/86451.Ill_Wind
Slave to Sensation (Psy-Changeling, #1)	Nalini Singh	4.07	70,491	https://www.goodreads.com/book/show/178476.Slave_to_Sensation
Inkheart (Inkworld, #1)	Cornelia Funke	3.89	405,115	https://www.goodreads.com/book/show/28194.Inkheart
First Drop of Crimson (Night Huntress World, #1)	Jeaniene Frost	4.13	56,784	https://www.goodreads.com/book/show/6547187-first-drop-of-crimson
Nightlife (Cal Leandros #1)	Rob Thurman	3.64	13,029	https://www.goodreads.com/book/show/421007.Nightlife
Something from the Nightside (Nightside, #1)	Simon R. Green	3.77	23,622	https://www.goodreads.com/book/show/155421.Something_from_the_Nightside
Watchmen	Alan Moore	4.37	513,117	https://www.goodreads.com/book/show/472331.Watchmen
On the Prowl (Alpha & Omega, #0.5)	Patricia Briggs	4.03	29,531	https://www.goodreads.com/book/show/285212.On_the_Prowl
Evermore (The Immortals, #1)	Alyson Noel	3.59	284,798	https://www.goodreads.com/book/show/3975774-evermore
Urban Shaman (Walker Papers, #1)	C.E. Murphy	3.73	14,548	https://www.goodreads.com/book/show/297929.Urban_Shaman
Greywalker (Greywalker, #1)	Kat Richardson	3.46	13,424	https://www.goodreads.com/book/show/140099.Greywalker
Fantasy Lover (Hunter Legends, #1)	Sherrilyn Kenyon	4.14	90,590	https://www.goodreads.com/book/show/84136.Fantasy_Lover
Working for the Devil (Dante Valentine, #1)	Lilith Saintcrow	3.80	12,364	https://www.goodreads.com/book/show/277897.Working_for_the_Devil
Unholy Ghosts (Downside Ghosts, #1)	Stacia Kane	3.65	18,014	https://www.goodreads.com/book/show/6261189-unholy-ghosts
Blue Bloods (Blue Bloods, #1)	Melissa de la Cruz	3.69	141,476	https://www.goodreads.com/book/show/872333.Blue_Bloods
Rivers of London (Rivers of London, #1)	Ben Aaronovitch	3.85	114,157	https://www.goodreads.com/book/show/9317452-rivers-of-london
The Secret Hour (Midnighters, #1)	Scott Westerfeld	3.81	28,781	https://www.goodreads.com/book/show/24766.The_Secret_Hour
Goddess of Spring (Goddess Summoning, #2)	P.C. Cast	4.20	9,954	https://www.goodreads.com/book/show/30194.Goddess_of_Spring
Silver Borne (Mercy Thompson, #5)	Patricia Briggs	4.36	101,057	https://www.goodreads.com/book/show/6587387-silver-borne
Goddess of Light (Goddess Summoning, #3)	P.C. Cast	4.04	7,120	https://www.goodreads.com/book/show/30190.Goddess_of_Light
The Darkest Kiss (Lords of the Underworld, #2)	Gena Showalter	4.22	54,890	https://www.goodreads.com/book/show/2498983.The_Darkest_Kiss
The Blue Girl (Newford, #15)	Charles de Lint	3.93	9,635	https://www.goodreads.com/book/show/182332.The_Blue_Girl
The Iron Daughter (The Iron Fey, #2)	Julie Kagawa	4.05	129,718	https://www.goodreads.com/book/show/7747064-the-iron-daughter
Interview with the Vampire (The Vampire Chronicles, #1)	Anne Rice	4.00	522,959	https://www.goodreads.com/book/show/43763.Interview_with_the_Vampire
The Darkest Night (Lords of the Underworld, #1)	Gena Showalter	4.05	82,918	https://www.goodreads.com/book/show/476543.The_Darkest_Night
Strange Angels (Strange Angels, #1)	Lili St. Crow	3.78	41,969	https://www.goodreads.com/book/show/6006518-strange-angels
Crescendo (Hush, Hush, #2)	Becca Fitzpatrick	4.00	303,735	https://www.goodreads.com/book/show/7791997-crescendo
Seize the Night (Dark-Hunter #6)	Sherrilyn Kenyon	4.32	47,711	https://www.goodreads.com/book/show/84144.Seize_the_Night
City of Lost Souls (The Mortal Instruments, #5)	Cassandra Clare	4.23	479,402	https://www.goodreads.com/book/show/8755776-city-of-lost-souls
Undead and Unwed (Undead, #1)	MaryJanice Davidson	3.80	57,518	https://www.goodreads.com/book/show/421129.Undead_and_Unwed
Blood Price (Vicki Nelson #1)	Tanya Huff	3.75	10,164	https://www.goodreads.com/book/show/317121.Blood_Price
Full Moon Rising (Riley Jenson Guardian #1)	Keri Arthur	3.88	34,593	https://www.goodreads.com/book/show/172764.Full_Moon_Rising
Cast in Shadow (Chronicles of Elantra, #1)	Michelle Sagara	3.79	16,586	https://www.goodreads.com/book/show/9542.Cast_in_Shadow
Dead in the Family (Sookie Stackhouse, #10)	Charlaine Harris	3.88	160,431	https://www.goodreads.com/book/show/7091488-dead-in-the-family
Hexed (The Iron Druid Chronicles, #2)	Kevin Hearne	4.22	57,917	https://www.goodreads.com/book/show/9595650-hexed
Night Pleasures (Dark-Hunter #1)	Sherrilyn Kenyon	4.18	77,272	https://www.goodreads.com/book/show/84150.Night_Pleasures
Someplace to Be Flying (Newford, #5)	Charles de Lint	4.32	5,590	https://www.goodreads.com/book/show/186427.Someplace_to_Be_Flying
The Master and Margarita	Mikhail Bulgakov	4.28	278,133	https://www.goodreads.com/book/show/117833.The_Master_and_Margarita
The Darkest Pleasure (Lords of the Underworld, #3)	Gena Showalter	4.25	47,849	https://www.goodreads.com/book/show/2712967-the-darkest-pleasure
A Kiss of Shadows (Merry Gentry, #1)	Laurell K. Hamilton	4.00	57,372	https://www.goodreads.com/book/show/139417.A_Kiss_of_Shadows
The Onion Girl (Newford, #8)	Charles de Lint	4.16	7,599	https://www.goodreads.com/book/show/543343.The_Onion_Girl
Red-Headed Stepchild (Sabina Kane, #1)	Jaye Wells	3.70	16,692	https://www.goodreads.com/book/show/6056520-red-headed-stepchild
Sins of the Night (Dark-Hunter, #7)	Sherrilyn Kenyon	4.14	37,737	https://www.goodreads.com/book/show/84135.Sins_of_the_Night
Blood Bound (Mercy Thompson, #2)	Patricia Briggs	4.29	119,484	https://www.goodreads.com/book/show/285205.Blood_Bound
Eternal Kiss of Darkness (Night Huntress World, #2)	Jeaniene Frost	4.18	43,603	https://www.goodreads.com/book/show/6871616-eternal-kiss-of-darkness
This Side of the Grave (Night Huntress, #5)	Jeaniene Frost	4.25	61,953	https://www.goodreads.com/book/show/6871617-this-side-of-the-grave
Iron Kissed (Mercy Thompson, #3)	Patricia Briggs	4.31	119,296	https://www.goodreads.com/book/show/1412138.Iron_Kissed
Ghost Story (The Dresden Files, #13)	Jim Butcher	4.25	88,750	https://www.goodreads.com/book/show/8058301-ghost-story
For the Love of Hades (Loves of Olympus, #2)	Sasha Summers	3.95	1,371	https://www.goodreads.com/book/show/13600791-for-the-love-of-hades
Peeps (Peeps, #1)	Scott Westerfeld	3.77	24,283	https://www.goodreads.com/book/show/186103.Peeps
Dreams Underfoot (Newford, #1)	Charles de Lint	4.11	8,526	https://www.goodreads.com/book/show/186444.Dreams_Underfoot
Men of the Otherworld (Otherworld Stories, #1)	Kelley Armstrong	4.26	15,876	https://www.goodreads.com/book/show/3422075-men-of-the-otherworld
Frost Burned (Mercy Thompson, #7)	Patricia Briggs	4.34	68,943	https://www.goodreads.com/book/show/13413589-frost-burned
Mark of the Demon (Kara Gillian, #1)	Diana Rowland	3.82	14,252	https://www.goodreads.com/book/show/6048518-mark-of-the-demon
Wake (Wake, #1)	Lisa McMann	3.75	82,956	https://www.goodreads.com/book/show/1661957.Wake
Night Embrace (Dark-Hunter #2)	Sherrilyn Kenyon	4.21	59,732	https://www.goodreads.com/book/show/84140.Night_Embrace
Cold Days (The Dresden Files, #14)	Jim Butcher	4.45	94,782	https://www.goodreads.com/book/show/12216302-cold-days
Magic Burns (Kate Daniels, #2)	Ilona Andrews	4.30	80,666	https://www.goodreads.com/book/show/1811543.Magic_Burns
Covet (Fallen Angels, #1)	J.R. Ward	3.90	50,162	https://www.goodreads.com/book/show/6289920-covet
Fair Game (Alpha & Omega, #3; Mercy Thompson World - Complete #9)	Patricia Briggs	4.31	51,164	https://www.goodreads.com/book/show/7942786-fair-game
Moonheart	Charles de Lint	4.05	6,247	https://www.goodreads.com/book/show/618174.Moonheart
Pleasure Unbound (Demonica, #1)	Larissa Ione	4.03	54,380	https://www.goodreads.com/book/show/2679633-pleasure-unbound
The Sea of Monsters (Percy Jackson and the Olympians, #2)	Rick Riordan	4.24	880,274	https://www.goodreads.com/book/show/28186.The_Sea_of_Monsters
The Shining	Stephen King	4.24	1,253,456	https://www.goodreads.com/book/show/11588.The_Shining
Harry Potter and the Deathly Hallows (Harry Potter, #7)	J.K. Rowling	4.61	3,124,776	https://www.goodreads.com/book/show/136251.Harry_Potter_and_the_Deathly_Hallows
Bone Crossed (Mercy Thompson, #4)	Patricia Briggs	4.32	103,318	https://www.goodreads.com/book/show/3128411-bone-crossed
The Last Olympian (Percy Jackson and the Olympians, #5)	Rick Riordan	4.50	780,720	https://www.goodreads.com/book/show/4502507-the-last-olympian
Artemis Fowl (Artemis Fowl, #1)	Eoin Colfer	3.85	535,918	https://www.goodreads.com/book/show/249747.Artemis_Fowl
Vampire Academy Collection (Vampire Academy, #1-3)	Richelle Mead	4.61	33,907	https://www.goodreads.com/book/show/6339989-vampire-academy-collection
Pale Demon (The Hollows, #9)	Kim Harrison	4.40	47,950	https://www.goodreads.com/book/show/8138071-pale-demon
Once Burned (Night Prince, #1)	Jeaniene Frost	4.19	66,346	https://www.goodreads.com/book/show/7039218-once-burned
Harry Potter and the Prisoner of Azkaban (Harry Potter, #3)	J.K. Rowling	4.57	3,245,297	https://www.goodreads.com/book/show/5.Harry_Potter_and_the_Prisoner_of_Azkaban
The Hobbit, or There and Back Again	J.R.R. Tolkien	4.28	3,224,449	https://www.goodreads.com/book/show/5907.The_Hobbit_or_There_and_Back_Again
The Killing Dance (Anita Blake, Vampire Hunter, #6)	Laurell K. Hamilton	4.11	71,486	https://www.goodreads.com/book/show/30244.The_Killing_Dance
Outlander (Outlander, #1)	Diana Gabaldon	4.23	914,937	https://www.goodreads.com/book/show/10964.Outlander
Magic Slays (Kate Daniels, #5)	Ilona Andrews	4.39	69,907	https://www.goodreads.com/book/show/8559047-magic-slays
Sandman Slim (Sandman Slim, #1)	Richard Kadrey	3.94	34,366	https://www.goodreads.com/book/show/5776788-sandman-slim
Hammered (The Iron Druid Chronicles, #3)	Kevin Hearne	4.21	49,672	https://www.goodreads.com/book/show/9595620-hammered
Wicked Deeds on a Winter's Night (Immortals After Dark, #3)	Kresley Cole	4.32	53,541	https://www.goodreads.com/book/show/435045.Wicked_Deeds_on_a_Winter_s_Night
Blue Moon (The Immortals, #2)	Alyson Noel	3.61	96,617	https://www.goodreads.com/book/show/6134826-blue-moon
Obsidian (Lux, #1)	Jennifer L. Armentrout	4.14	263,113	https://www.goodreads.com/book/show/12578077-obsidian
Betrayals (Strange Angels, #2)	Lili St. Crow	4.08	26,215	https://www.goodreads.com/book/show/6371117-betrayals
Harry Potter and the Half-Blood Prince (Harry Potter, #6)	J.K. Rowling	4.57	2,726,742	https://www.goodreads.com/book/show/1.Harry_Potter_and_the_Half_Blood_Prince
To Live and Die in Fantasyland (To Live, #3)	Ben Peller	4.29	91	https://www.goodreads.com/book/show/17889664-to-live-and-die-in-fantasyland
Living with the Dead (Women of the Otherworld, #9)	Kelley Armstrong	4.03	17,978	https://www.goodreads.com/book/show/2813124-living-with-the-dead
Unearthly (Unearthly, #1)	Cynthia Hand	4.00	130,707	https://www.goodreads.com/book/show/7488244-unearthly
The Iron Queen (The Iron Fey, #3)	Julie Kagawa	4.18	106,628	https://www.goodreads.com/book/show/8685612-the-iron-queen
The Lost Hero (The Heroes of Olympus, #1)	Rick Riordan	4.31	713,049	https://www.goodreads.com/book/show/7736182-the-lost-hero
Kiss of Snow (Psy-Changeling, #10)	Nalini Singh	4.45	29,084	https://www.goodreads.com/book/show/8712343-kiss-of-snow
Burn for Me (Hidden Legacy, #1)	Ilona Andrews	4.31	50,060	https://www.goodreads.com/book/show/20705702-burn-for-me
One Grave at a Time (Night Huntress, #6)	Jeaniene Frost	4.21	48,168	https://www.goodreads.com/book/show/7954556-one-grave-at-a-time
Summer Knight (The Dresden Files, #4)	Jim Butcher	4.25	141,097	https://www.goodreads.com/book/show/91478.Summer_Knight
Dark Needs at Night's Edge (Immortals After Dark, #4)	Kresley Cole	4.28	49,316	https://www.goodreads.com/book/show/1611656.Dark_Needs_at_Night_s_Edge
Paranormalcy (Paranormalcy, #1)	Kiersten White	3.87	102,247	https://www.goodreads.com/book/show/7719245-paranormalcy
Pleasure of a Dark Prince (Immortals After Dark, #8)	Kresley Cole	4.35	43,696	https://www.goodreads.com/book/show/6337006-pleasure-of-a-dark-prince
Changes (The Dresden Files, #12)	Jim Butcher	4.49	105,123	https://www.goodreads.com/book/show/6585201-changes
Warrior Rising (Goddess Summoning, #6)	P.C. Cast	4.14	5,250	https://www.goodreads.com/book/show/2344214.Warrior_Rising
Dead Beat (The Dresden Files, #7)	Jim Butcher	4.38	119,849	https://www.goodreads.com/book/show/17683.Dead_Beat
Nightwalker (Dark Days, #1)	Jocelynn Drake	3.68	9,412	https://www.goodreads.com/book/show/20564828-nightwalker
Caressed by Ice (Psy-Changeling #3)	Nalini Singh	4.26	38,412	https://www.goodreads.com/book/show/458034.Caressed_by_Ice
The Raven Boys (The Raven Cycle, #1)	Maggie Stiefvater	4.03	320,430	https://www.goodreads.com/book/show/17675462-the-raven-boys
The Dead Girls' Dance (The Morganville Vampires, #2)	Rachel Caine	4.03	57,917	https://www.goodreads.com/book/show/261122.The_Dead_Girls_Dance
Kitty Goes to Washington (Kitty Norville, #2)	Carrie Vaughn	3.88	19,987	https://www.goodreads.com/book/show/14460.Kitty_Goes_to_Washington
Linger (The Wolves of Mercy Falls, #2)	Maggie Stiefvater	3.88	168,695	https://www.goodreads.com/book/show/6654313-linger
Night Play (Dark-Hunter, #5; Were-Hunter, #1)	Sherrilyn Kenyon	4.32	53,829	https://www.goodreads.com/book/show/84151.Night_Play
Burnt Offerings (Anita Blake, Vampire Hunter, #7)	Laurell K. Hamilton	4.07	68,494	https://www.goodreads.com/book/show/30242.Burnt_Offerings
Firelight (Firelight, #1)	Sophie Jordan	3.84	70,693	https://www.goodreads.com/book/show/6448470-firelight
City of Ghosts (Downside Ghosts, #3)	Stacia Kane	4.22	9,211	https://www.goodreads.com/book/show/7352840-city-of-ghosts
A Dirty Job (Grim Reaper, #1)	Christopher Moore	4.00	119,426	https://www.goodreads.com/book/show/33456.A_Dirty_Job
Magic Strikes (Kate Daniels, #3)	Ilona Andrews	4.41	79,231	https://www.goodreads.com/book/show/4345498-magic-strikes
Magic Bleeds (Kate Daniels, #4)	Ilona Andrews	4.42	77,757	https://www.goodreads.com/book/show/6479550-magic-bleeds
River Marked (Mercy Thompson, #6)	Patricia Briggs	4.26	83,448	https://www.goodreads.com/book/show/8087906-river-marked
Kiss of a Demon King (Immortals After Dark, #6)	Kresley Cole	4.30	42,885	https://www.goodreads.com/book/show/3585344-kiss-of-a-demon-king
Jack of Kinrowan: Jack the Giant-Killer / Drink Down the Moon	Charles de Lint	4.12	3,811	https://www.goodreads.com/book/show/13506.Jack_of_Kinrowan
A Local Habitation (October Daye, #2)	Seanan McGuire	3.90	18,168	https://www.goodreads.com/book/show/6782465-a-local-habitation
Industrial Magic (Women of the Otherworld, #4)	Kelley Armstrong	4.10	37,372	https://www.goodreads.com/book/show/125925.Industrial_Magic
Thorn Queen (Dark Swan, #2)	Richelle Mead	4.12	20,815	https://www.goodreads.com/book/show/5996209-thorn-queen
Web of Lies (Elemental Assassin, #2)	Jennifer Estep	4.10	22,014	https://www.goodreads.com/book/show/6933152-web-of-lies
Hex Hall (Hex Hall, #1)	Rachel Hawkins	3.91	146,648	https://www.goodreads.com/book/show/5287473-hex-hall
Archangel's Consort (Guild Hunter, #3)	Nalini Singh	4.20	41,935	https://www.goodreads.com/book/show/7307503-archangel-s-consort
Hunting Ground (Alpha & Omega, #2)	Patricia Briggs	4.25	66,054	https://www.goodreads.com/book/show/5292853-hunting-ground
Half-Blood (Covenant, #1)	Jennifer L. Armentrout	4.09	96,111	https://www.goodreads.com/book/show/9680718-half-blood
Night Broken (Mercy Thompson, #8)	Patricia Briggs	4.40	59,094	https://www.goodreads.com/book/show/17562900-night-broken
The Darkest Whisper (Lords of the Underworld, #4)	Gena Showalter	4.28	44,536	https://www.goodreads.com/book/show/5509920-the-darkest-whisper
Children of the Night (Diana Tregarde, #2)	Mercedes Lackey	3.95	5,326	https://www.goodreads.com/book/show/14012.Children_of_the_Night
Greenmantle	Charles de Lint	4.01	3,271	https://www.goodreads.com/book/show/186423.Greenmantle
A Madness of Angels (Matthew Swift, #1)	Kate Griffin	3.75	7,700	https://www.goodreads.com/book/show/6186355-a-madness-of-angels
Blood Cross (Jane Yellowrock, #2)	Faith Hunter	4.15	23,407	https://www.goodreads.com/book/show/6659254-blood-cross
Fool Moon (The Dresden Files, #2)	Jim Butcher	3.99	181,313	https://www.goodreads.com/book/show/91477.Fool_Moon
Visions of Heat (Psy-Changeling, #2)	Nalini Singh	4.07	38,839	https://www.goodreads.com/book/show/215643.Visions_of_Heat
Trader (Newford, #4)	Charles de Lint	4.09	2,853	https://www.goodreads.com/book/show/186419.Trader
Unholy Magic (Downside Ghosts, #2)	Stacia Kane	4.07	10,276	https://www.goodreads.com/book/show/6557156-unholy-magic
A Perfect Blood (The Hollows, #10)	Kim Harrison	4.38	35,346	https://www.goodreads.com/book/show/10599805-a-perfect-blood
No Rest for the Wicked (Immortals After Dark, #2)	Kresley Cole	4.26	56,071	https://www.goodreads.com/book/show/14383.No_Rest_for_the_Wicked
Masquerade (Blue Bloods, #2)	Melissa de la Cruz	3.89	93,936	https://www.goodreads.com/book/show/106085.Masquerade
Dark Prince (Dark, #1)	Christine Feehan	3.99	56,006	https://www.goodreads.com/book/show/28866.Dark_Prince
An Artificial Night (October Daye, #3)	Seanan McGuire	4.18	18,600	https://www.goodreads.com/book/show/6782468-an-artificial-night
Cast in Courtlight (Chronicles of Elantra, #2)	Michelle Sagara	4.12	10,363	https://www.goodreads.com/book/show/30189.Cast_in_Courtlight
Mind Games (The Disillusionists, #1)	Carolyn Crane	3.49	8,420	https://www.goodreads.com/book/show/6890220-mind-games
Torment (Fallen, #2)	Lauren Kate	3.85	228,297	https://www.goodreads.com/book/show/7740152-torment
Kiss of Crimson (Midnight Breed, #2)	Lara Adrian	4.12	42,931	https://www.goodreads.com/book/show/715791.Kiss_of_Crimson
Kitty Takes a Holiday (Kitty Norville, #3)	Carrie Vaughn	3.91	17,689	https://www.goodreads.com/book/show/14463.Kitty_Takes_a_Holiday
Grave Dance (Alex Craft, #2)	Kalayna Price	4.09	22,050	https://www.goodreads.com/book/show/9565574-grave-dance
The Warrior Heir (The Heir Chronicles, #1)	Cinda Williams Chima	3.94	49,736	https://www.goodreads.com/book/show/213647.The_Warrior_Heir
Sookie Stackhouse 8 Volume Set (Sookie Stackhouse, #1-8)	Charlaine Harris	4.29	9,731	https://www.goodreads.com/book/show/6288362-sookie-stackhouse-8-volume-set
The Titan's Curse (Percy Jackson and the Olympians, #3)	Rick Riordan	4.34	806,224	https://www.goodreads.com/book/show/561456.The_Titan_s_Curse
The Black Dagger Brotherhood: An Insider's Guide	J.R. Ward	4.32	29,883	https://www.goodreads.com/book/show/2880715-the-black-dagger-brotherhood
Harry Potter and the Order of the Phoenix (Harry Potter, #5)	J.K. Rowling	4.50	2,813,201	https://www.goodreads.com/book/show/2.Harry_Potter_and_the_Order_of_the_Phoenix
Raised by Wolves (Raised by Wolves, #1)	Jennifer Lynn Barnes	3.91	30,592	https://www.goodreads.com/book/show/6905534-raised-by-wolves
City of Ashes (The Mortal Instruments, #2)	Cassandra Clare	4.13	836,050	https://www.goodreads.com/book/show/1582996.City_of_Ashes
Dreams of a Dark Warrior (Immortals After Dark, #10)	Kresley Cole	4.32	39,008	https://www.goodreads.com/book/show/8534799-dreams-of-a-dark-warrior
