title	author	ave_rating	no_rating	link
Shadows of Self (Mistborn, #5)	Brandon Sanderson	4.27	102,184	https://www.goodreads.com/book/show/16065004-shadows-of-self
Queen of Fire (Raven's Shadow, #3)	Anthony Ryan	3.69	24,532	https://www.goodreads.com/book/show/18405221-queen-of-fire
The Liar's Key (The Red Queen's War, #2)	Mark Lawrence	4.25	18,000	https://www.goodreads.com/book/show/22852698-the-liar-s-key
Firefight (The Reckoners, #2)	Brandon Sanderson	4.26	89,805	https://www.goodreads.com/book/show/15704459-firefight
The Skull Throne (Demon Cycle, #4)	Peter V. Brett	4.14	34,945	https://www.goodreads.com/book/show/13630171-the-skull-throne
The Autumn Republic (Powder Mage, #3)	Brian McClellan	4.37	26,266	https://www.goodreads.com/book/show/20883847-the-autumn-republic
Fool's Quest (The Fitz and The Fool, #2)	Robin Hobb	4.52	34,260	https://www.goodreads.com/book/show/23157777-fool-s-quest
The Death of Dulgath (The Riyria Chronicles, #3)	Michael J. Sullivan	4.39	14,538	https://www.goodreads.com/book/show/24683898-the-death-of-dulgath
The Aeronaut's Windlass (The Cinder Spires, #1)	Jim Butcher	4.18	38,580	https://www.goodreads.com/book/show/24876258-the-aeronaut-s-windlass
Half the World (Shattered Sea, #2)	Joe Abercrombie	4.20	32,728	https://www.goodreads.com/book/show/21066604-half-the-world
The Providence of Fire (Chronicle of the Unhewn Throne, #2)	Brian Staveley	4.12	21,580	https://www.goodreads.com/book/show/22055280-the-providence-of-fire
Armada	Ernest Cline	3.55	109,918	https://www.goodreads.com/book/show/16278318-armada
Queen of Shadows (Throne of Glass, #4)	Sarah J. Maas	4.53	334,475	https://www.goodreads.com/book/show/18006496-queen-of-shadows
Half a War (Shattered Sea, #3)	Joe Abercrombie	4.03	26,489	https://www.goodreads.com/book/show/22381326-half-a-war
Winter (The Lunar Chronicles, #4)	Marissa Meyer	4.41	234,410	https://www.goodreads.com/book/show/13206900-winter
Magic Shifts (Kate Daniels, #8)	Ilona Andrews	4.40	39,386	https://www.goodreads.com/book/show/17333171-magic-shifts
A Darker Shade of Magic (Shades of Magic, #1)	V.E. Schwab	4.06	258,818	https://www.goodreads.com/book/show/22055262-a-darker-shade-of-magic
A Court of Thorns and Roses (A Court of Thorns and Roses, #1)	Sarah J. Maas	4.18	792,824	https://www.goodreads.com/book/show/16096824-a-court-of-thorns-and-roses
Golden Son (Red Rising Saga, #2)	Pierce Brown	4.43	171,311	https://www.goodreads.com/book/show/18966819-golden-son
Nemesis Games (The Expanse, #5)	James S.A. Corey	4.41	71,757	https://www.goodreads.com/book/show/22886612-nemesis-games
Seveneves	Neal Stephenson	3.98	106,295	https://www.goodreads.com/book/show/22752699-seveneves
Vision in Silver (The Others, #3)	Anne Bishop	4.21	33,524	https://www.goodreads.com/book/show/21457243-vision-in-silver
The Fifth Season (The Broken Earth, #1)	N.K. Jemisin	4.27	199,790	https://www.goodreads.com/book/show/19161852-the-fifth-season
Uprooted	Naomi Novik	4.04	202,133	https://www.goodreads.com/book/show/22448211-uprooted
Dead Heat (Alpha & Omega #4, Mercy Thompson World - Complete #11)	Patricia Briggs	4.26	35,622	https://www.goodreads.com/book/show/22571699-dead-heat
Ancillary Mercy (Imperial Radch, #3)	Ann Leckie	4.19	38,165	https://www.goodreads.com/book/show/23533039-ancillary-mercy
The Price of Valour (The Shadow Campaigns, #3)	Django Wexler	4.25	7,594	https://www.goodreads.com/book/show/23346335-the-price-of-valour
Red Queen (Red Queen, #1)	Victoria Aveyard	4.03	728,041	https://www.goodreads.com/book/show/17878931-red-queen
The End of All Things (Old Man's War, #6)	John Scalzi	3.98	21,594	https://www.goodreads.com/book/show/23168809-the-end-of-all-things
Six of Crows (Six of Crows, #1)	Leigh Bardugo	4.47	566,924	https://www.goodreads.com/book/show/23437156-six-of-crows
The Beast of Cretacea	Todd Strasser	4.17	522	https://www.goodreads.com/book/show/24727083-the-beast-of-cretacea
Trigger Warning: Short Fictions and Disturbances	Neil Gaiman	3.90	58,264	https://www.goodreads.com/book/show/22522808-trigger-warning
The Sword of Summer (Magnus Chase and the Gods of Asgard, #1)	Rick Riordan	4.21	179,858	https://www.goodreads.com/book/show/15724396-the-sword-of-summer
The Dread Wyrm (The Traitor Son Cycle, #3)	Miles Cameron	4.37	6,708	https://www.goodreads.com/book/show/23129080-the-dread-wyrm
Prudence (The Custard Protocol, #1)	Gail Carriger	3.81	15,240	https://www.goodreads.com/book/show/12799420-prudence
Ruin (The Faithful and the Fallen, #3)	John Gwynne	4.46	11,990	https://www.goodreads.com/book/show/23524878-ruin
A Knight of the Seven Kingdoms (The Tales of Dunk and Egg, #1-3)	George R.R. Martin	4.18	75,102	https://www.goodreads.com/book/show/23306321-a-knight-of-the-seven-kingdoms
The Grace of Kings (The Dandelion Dynasty, #1)	Ken Liu	3.73	13,568	https://www.goodreads.com/book/show/18952341-the-grace-of-kings
White Hot (Hidden Legacy, #2)	Ilona Andrews	4.45	36,640	https://www.goodreads.com/book/show/22303684-white-hot
Fall of Light (The Kharkanas Trilogy, #2)	Steven Erikson	4.15	3,113	https://www.goodreads.com/book/show/19381626-fall-of-light
Shadow Scale (Seraphina, #2)	Rachel Hartman	3.74	18,279	https://www.goodreads.com/book/show/16085457-shadow-scale
End of Days (Penryn & the End of Days, #3)	Susan Ee	4.04	68,269	https://www.goodreads.com/book/show/18500665-end-of-days
Fairest (The Lunar Chronicles, #3.5)	Marissa Meyer	3.96	125,020	https://www.goodreads.com/book/show/22489107-fairest
Blackguards: Tales of Assassins, Mercenaries, and Rogues	J.M. Martin	3.82	665	https://www.goodreads.com/book/show/23156342-blackguards
A Red-Rose Chain (October Daye, #9)	Seanan McGuire	4.30	9,558	https://www.goodreads.com/book/show/15748535-a-red-rose-chain
The Shepherd's Crown (Discworld, #41; Tiffany Aching, #5)	Terry Pratchett	4.37	25,648	https://www.goodreads.com/book/show/22886868-the-shepherd-s-crown
The Dinosaur Lords (The Dinosaur Lords, #1)	Victor Milán	3.10	2,458	https://www.goodreads.com/book/show/19000898-the-dinosaur-lords
Stiletto (The Checquy Files, #2)	Daniel O'Malley	4.14	18,252	https://www.goodreads.com/book/show/17733757-stiletto
Sword of the North (Grim Company, #2)	Luke Scull	4.07	3,608	https://www.goodreads.com/book/show/18114110-sword-of-the-north
Karen Memory (Karen Memory, #1)	Elizabeth Bear	3.73	4,476	https://www.goodreads.com/book/show/21895076-karen-memory
An Ember in the Ashes (An Ember in the Ashes, #1)	Sabaa Tahir	4.25	234,367	https://www.goodreads.com/book/show/20560137-an-ember-in-the-ashes
Radiance	Catherynne M. Valente	3.74	4,231	https://www.goodreads.com/book/show/18490533-radiance
Shadow Study (Soulfinders #1; Study, #4)	Maria V. Snyder	4.08	14,992	https://www.goodreads.com/book/show/16130758-shadow-study
Manners & Mutiny (Finishing School, #4)	Gail Carriger	4.23	14,709	https://www.goodreads.com/book/show/18725742-manners-mutiny
The City of Mirrors (The Passage, #3)	Justin Cronin	4.20	49,183	https://www.goodreads.com/book/show/12379094-the-city-of-mirrors
The Water Knife	Paolo Bacigalupi	3.85	24,421	https://www.goodreads.com/book/show/17928887-the-water-knife
Cast in Honor (Chronicles of Elantra, #11)	Michelle Sagara	4.15	3,638	https://www.goodreads.com/book/show/22665491-cast-in-honor
City of Blades (The Divine Cities, #2)	Robert Jackson Bennett	4.21	13,875	https://www.goodreads.com/book/show/23909755-city-of-blades
Knight's Shadow (Greatcoats, #2)	Sebastien de Castell	4.24	10,677	https://www.goodreads.com/book/show/23165000-knight-s-shadow
Those Above (The Empty Throne, #1)	Daniel Polansky	3.66	1,530	https://www.goodreads.com/book/show/21017636-those-above
Slow Bullets	Alastair Reynolds	3.61	4,169	https://www.goodreads.com/book/show/23013875-slow-bullets
The Voyage of the Basilisk (The Memoirs of Lady Trent, #3)	Marie Brennan	4.19	6,845	https://www.goodreads.com/book/show/21893608-the-voyage-of-the-basilisk
The Dark Forest (Remembrance of Earth’s Past, #2)	Liu Cixin	4.40	86,029	https://www.goodreads.com/book/show/23168817-the-dark-forest
The Orphan Queen (The Orphan Queen, #1)	Jodi Meadows	3.96	14,078	https://www.goodreads.com/book/show/18081228-the-orphan-queen
Gemini Cell (Reawakening Trilogy #1)	Myke Cole	3.64	1,925	https://www.goodreads.com/book/show/17888374-gemini-cell
The Just City (Thessaly, #1)	Jo Walton	3.79	6,376	https://www.goodreads.com/book/show/20573883-the-just-city
Time Salvager (Time Salvager, #1)	Wesley Chu	3.69	4,302	https://www.goodreads.com/book/show/23168818-time-salvager
Pocket Apocalypse (InCryptid, #4)	Seanan McGuire	4.05	5,763	https://www.goodreads.com/book/show/23215076-pocket-apocalypse
The Mechanical (The Alchemy Wars, #1)	Ian Tregillis	3.96	6,250	https://www.goodreads.com/book/show/20980667-the-mechanical
Dark Intelligence (Transformation, #1)	Neal Asher	4.06	5,711	https://www.goodreads.com/book/show/22859850-dark-intelligence
Last First Snow (Craft Sequence, #4)	Max Gladstone	4.02	3,451	https://www.goodreads.com/book/show/23168830-last-first-snow
Court of Fives (Court of Fives, #1)	Kate Elliott	3.72	7,589	https://www.goodreads.com/book/show/18068907-court-of-fives
Illuminae (The Illuminae Files, #1)	Amie Kaufman	4.24	138,021	https://www.goodreads.com/book/show/23395680-illuminae
Aurora	Kim Stanley Robinson	3.77	23,621	https://www.goodreads.com/book/show/23197269-aurora
Unbound (Magic Ex Libris, #3)	Jim C. Hines	4.13	3,335	https://www.goodreads.com/book/show/18139127-unbound
Ice Like Fire (Snow Like Ashes, #2)	Sara Raasch	3.75	21,497	https://www.goodreads.com/book/show/17404295-ice-like-fire
Updraft (Bone Universe, #1)	Fran Wilde	3.59	3,202	https://www.goodreads.com/book/show/18464362-updraft
An Ancient Peace (Peacekeeper, #1; Confederation, #6)	Tanya Huff	4.02	2,216	https://www.goodreads.com/book/show/24611981-an-ancient-peace
The Traitor Baru Cormorant (The Masquerade, #1)	Seth Dickinson	4.06	15,158	https://www.goodreads.com/book/show/23444482-the-traitor-baru-cormorant
The Boy Who Lost Fairyland (Fairyland, #4)	Catherynne M. Valente	4.16	2,614	https://www.goodreads.com/book/show/18961361-the-boy-who-lost-fairyland
A Crown for Cold Silver (The Crimson Empire #1)	Alex Marshall	3.69	3,248	https://www.goodreads.com/book/show/22875083-a-crown-for-cold-silver
The Ruby Circle (Bloodlines, #6)	Richelle Mead	4.20	47,174	https://www.goodreads.com/book/show/8709528-the-ruby-circle
The Book of Phoenix (Who Fears Death, #0)	Nnedi Okorafor	3.95	4,506	https://www.goodreads.com/book/show/23281789-the-book-of-phoenix
Dragon of the Stars	Alex J. Cavanaugh	4.34	176	https://www.goodreads.com/book/show/23521766-dragon-of-the-stars
Love in the Age of Mechanical Reproduction	Judd Trichter	3.51	550	https://www.goodreads.com/book/show/22545439-love-in-the-age-of-mechanical-reproduction
Air Awakens (Air Awakens, #1)	Elise Kova	4.01	34,873	https://www.goodreads.com/book/show/23127048-air-awakens
The House of Shattered Wings (Dominion of the Fallen, #1)	Aliette de Bodard	3.40	3,911	https://www.goodreads.com/book/show/23601046-the-house-of-shattered-wings
Staked (The Iron Druid Chronicles, #8)	Kevin Hearne	4.24	20,281	https://www.goodreads.com/book/show/16280689-staked
Guns of the Dawn	Adrian Tchaikovsky	4.15	2,365	https://www.goodreads.com/book/show/23524779-guns-of-the-dawn
Three Moments of an Explosion	China Miéville	3.64	3,811	https://www.goodreads.com/book/show/23510565-three-moments-of-an-explosion
Immortal Matchmakers, Inc. (Immortal Matchmakers, #1)	Mimi Jean Pamfiloff	3.94	3,669	https://www.goodreads.com/book/show/26016162-immortal-matchmakers-inc
Black Wolves (Black Wolves, #1)	Kate Elliott	3.96	1,535	https://www.goodreads.com/book/show/20980680-black-wolves
The Galaxy Game	Karen Lord	3.08	748	https://www.goodreads.com/book/show/18142342-the-galaxy-game
Sorcerer to the Crown (Sorcerer Royal, #1)	Zen Cho	3.74	12,404	https://www.goodreads.com/book/show/23943137-sorcerer-to-the-crown
The Darkling Child (The Defenders of Shannara, #2)	Terry Brooks	3.93	3,826	https://www.goodreads.com/book/show/18710920-the-darkling-child
The Devil's Only Friend (John Cleaver, #4)	Dan Wells	4.13	4,099	https://www.goodreads.com/book/show/22665330-the-devil-s-only-friend
Tower of Thorns (Blackthorn & Grim, #2)	Juliet Marillier	4.17	7,439	https://www.goodreads.com/book/show/22567177-tower-of-thorns
The Annihilation Score (Laundry Files, #6)	Charles Stross	3.91	6,609	https://www.goodreads.com/book/show/23154785-the-annihilation-score
The Vanishing Throne (The Falconer, #2)	Elizabeth May	4.15	6,946	https://www.goodreads.com/book/show/19401348-the-vanishing-throne
Walk on Earth a Stranger (The Gold Seer Trilogy, #1)	Rae Carson	3.92	18,347	https://www.goodreads.com/book/show/17564519-walk-on-earth-a-stranger
Crimson Bound	Rosamund Hodge	3.64	20,032	https://www.goodreads.com/book/show/21570318-crimson-bound
Of Noble Family (Glamourist Histories, #5)	Mary Robinette Kowal	4.14	2,033	https://www.goodreads.com/book/show/18873823-of-noble-family
Stories of the Raksura, Volume 2: The Dead City & The Dark Earth Below	Martha Wells	4.28	1,337	https://www.goodreads.com/book/show/22750124-stories-of-the-raksura-volume-2
Tell the Wind and Fire	Sarah Rees Brennan	3.44	3,051	https://www.goodreads.com/book/show/16221851-tell-the-wind-and-fire
Oracle (The House War, #6)	Michelle West	4.42	579	https://www.goodreads.com/book/show/18757501-oracle
The Scarlet Gospels	Clive Barker	3.48	8,088	https://www.goodreads.com/book/show/999397.The_Scarlet_Gospels
Drawn (Terra Sempre Saga, #1)	Chris Ledbetter	4.10	72	https://www.goodreads.com/book/show/23842764-drawn
Old Venus	George R.R. Martin	3.58	609	https://www.goodreads.com/book/show/22522799-old-venus
Nevermore (Cal Leandros, #10)	Rob Thurman	3.86	1,099	https://www.goodreads.com/book/show/23236648-nevermore
Frozen Tides (Falling Kingdoms, #4)	Morgan Rhodes	4.33	20,420	https://www.goodreads.com/book/show/17342701-frozen-tides
Dead of Winter (The Arcana Chronicles, #3)	Kresley Cole	4.33	15,538	https://www.goodreads.com/book/show/18746546-dead-of-winter
The Invasion of the Tearling (The Queen of the Tearling, #2)	Erika Johansen	4.11	49,127	https://www.goodreads.com/book/show/22698568-the-invasion-of-the-tearling
Leviathan (The Lost Fleet: Beyond the Frontier, #5)	Jack Campbell	4.19	5,668	https://www.goodreads.com/book/show/23281815-leviathan
Gran-sdur: The Games (Pha Yul, #2)	Jan Raymond	4.66	97	https://www.goodreads.com/book/show/23477479-gran-sdur
Hell Bound (Heroes in Hell #19)	Andrew P. Weston	4.15	91	https://www.goodreads.com/book/show/26809332-hell-bound
The King's Scrolls (Ilyon Chronicles, #2)	Jaye L. Knight	4.54	612	https://www.goodreads.com/book/show/23456237-the-king-s-scrolls
Draven's Light (Tales of Goldstone Wood, #7.5)	Anne Elisabeth Stengl	4.46	228	https://www.goodreads.com/book/show/24401179-draven-s-light
Son of the Morning (Banners of Blood, #1)	Mark Alder	3.64	593	https://www.goodreads.com/book/show/17680025-son-of-the-morning
Reap the Wind (Cassandra Palmer, #7)	Karen Chance	4.07	4,946	https://www.goodreads.com/book/show/18627947-reap-the-wind
The Wrath and the Dawn (The Wrath and the Dawn, #1)	Renée Ahdieh	4.07	150,880	https://www.goodreads.com/book/show/18798983-the-wrath-and-the-dawn
Black Heart	Mark Smylie	3.84	25	https://www.goodreads.com/book/show/23158317-black-heart
The Rose Society (The Young Elites, #2)	Marie Lu	4.05	55,516	https://www.goodreads.com/book/show/23846013-the-rose-society
Magonia (Magonia, #1)	Maria Dahvana Headley	3.54	17,918	https://www.goodreads.com/book/show/21393526-magonia
Twelve Kings in Sharakhai (The Song of the Shattered Sands, #1)	Bradley P. Beaulieu	3.94	6,231	https://www.goodreads.com/book/show/24611565-twelve-kings-in-sharakhai
The Philosopher Kings (Thessaly, #2)	Jo Walton	3.92	2,181	https://www.goodreads.com/book/show/19077294-the-philosopher-kings
An Apprentice to Elves (Iskryne World, #3)	Sarah Monette	3.89	427	https://www.goodreads.com/book/show/17256365-an-apprentice-to-elves
The Library at Mount Char	Scott Hawkins	4.09	38,279	https://www.goodreads.com/book/show/23363928-the-library-at-mount-char
The Bazaar of Bad Dreams	Stephen King	3.92	51,378	https://www.goodreads.com/book/show/23512999-the-bazaar-of-bad-dreams
Angel of Storms (Millennium’s Rule, #2)	Trudi Canavan	4.17	5,596	https://www.goodreads.com/book/show/17475481-angel-of-storms
Persona (Persona, #1)	Genevieve Valentine	3.33	707	https://www.goodreads.com/book/show/22456980-persona
Heir to the Jedi (Star Wars: Empire and Rebellion, #3)	Kevin Hearne	3.35	8,827	https://www.goodreads.com/book/show/22059478-heir-to-the-jedi
Dark Heir (Jane Yellowrock, #9)	Faith Hunter	4.33	9,002	https://www.goodreads.com/book/show/22584974-dark-heir
Cade	Mason Sabre	3.97	407	https://www.goodreads.com/book/show/26208748-cade
Empire Ascendant (Worldbreaker Saga, #2)	Kameron Hurley	3.87	1,392	https://www.goodreads.com/book/show/23920769-empire-ascendant
The Pyramids of London (The Trifold Age, #1)	Andrea K. Höst	3.87	331	https://www.goodreads.com/book/show/12390040-the-pyramids-of-london
Mechanica (Mechanica, #1)	Betsy Cornwell	3.61	4,556	https://www.goodreads.com/book/show/13455099-mechanica
The Witch Hunter (The Witch Hunter, #1)	Virginia Boecker	3.81	10,831	https://www.goodreads.com/book/show/18190208-the-witch-hunter
Shadow Team GB (Starbirth, #3)	J.M. Johnson	4.75	88	https://www.goodreads.com/book/show/25686470-shadow-team-gb
The Dead Lands	Benjamin Percy	3.45	3,537	https://www.goodreads.com/book/show/22875435-the-dead-lands
The Winner's Crime (The Winner's Trilogy, #2)	Marie Rutkoski	4.08	63,503	https://www.goodreads.com/book/show/20443207-the-winner-s-crime
The Immortal Heights (The Elemental Trilogy, #3)	Sherry Thomas	4.10	6,544	https://www.goodreads.com/book/show/17410991-the-immortal-heights
Death Marked (Death Sworn, #2)	Leah Cypess	3.22	2,049	https://www.goodreads.com/book/show/18803194-death-marked
Ender's Game (Ender's Saga, #1)	Orson Scott Card	4.30	1,230,702	https://www.goodreads.com/book/show/375802.Ender_s_Game
Lord of Ashes (Steelhaven, #3)	Richard S. Ford	3.71	530	https://www.goodreads.com/book/show/23525468-lord-of-ashes
Heartbound	P.I. Alltraine	3.80	86	https://www.goodreads.com/book/show/25766585-heartbound
Harrison Squared	Daryl Gregory	3.78	1,581	https://www.goodreads.com/book/show/22238192-harrison-squared
Hell's Foundations Quiver (Safehold, #8)	David Weber	4.16	3,747	https://www.goodreads.com/book/show/23847910-hell-s-foundations-quiver
Last Song Before Night	Ilana C. Myer	3.41	1,185	https://www.goodreads.com/book/show/23704941-last-song-before-night
Madness in Solidar (Imager Portfolio, #9)	L.E. Modesitt Jr.	4.20	1,591	https://www.goodreads.com/book/show/22238209-madness-in-solidar
False Hearts (Pacifica #1)	Laura Lam	3.69	1,542	https://www.goodreads.com/book/show/22816079-false-hearts
The Affinities	Robert Charles Wilson	3.40	2,287	https://www.goodreads.com/book/show/22238149-the-affinities
Tracker (Foreigner, #16)	C.J. Cherryh	4.39	1,414	https://www.goodreads.com/book/show/22544401-tracker
Son of the Black Sword (Saga of the Forgotten Warrior, #1)	Larry Correia	4.21	7,216	https://www.goodreads.com/book/show/25110977-son-of-the-black-sword
Stars Above (The Lunar Chronicles, #4.5)	Marissa Meyer	4.16	79,595	https://www.goodreads.com/book/show/25689074-stars-above
Clash of Eagles (Clash of Eagles, #1)	Alan Smale	3.81	1,498	https://www.goodreads.com/book/show/22570784-clash-of-eagles
Dreams of Shreds and Tatters	Amanda Downum	3.24	429	https://www.goodreads.com/book/show/22609208-dreams-of-shreds-and-tatters
Clash of Iron (Iron Age, #2)	Angus Watson	4.03	1,264	https://www.goodreads.com/book/show/22875122-clash-of-iron
The Iron Ghost (The Copper Cat, #2)	Jen Williams	4.13	1,091	https://www.goodreads.com/book/show/23451034-the-iron-ghost
The Blood Curse (Cursed Kingdoms, #3)	Emily Gee	4.03	971	https://www.goodreads.com/book/show/23203122-the-blood-curse
The Shadow Cabinet (Shades of London, #3)	Maureen Johnson	3.97	8,117	https://www.goodreads.com/book/show/17412895-the-shadow-cabinet
Trial of Intentions (The Vault of Heaven, #2)	Peter Orullian	3.85	247	https://www.goodreads.com/book/show/23168747-trial-of-intentions
Moonbreeze (The Dragonian, #4)	Adrienne Woods	4.20	4,194	https://www.goodreads.com/book/show/25712564-moonbreeze
Poet Anderson ...of Nightmares	Tom DeLonge	4.04	1,033	https://www.goodreads.com/book/show/25779243-poet-anderson-of-nightmares
Grudging (Birth of Saints, #1)	Michelle Hauck	4.24	187	https://www.goodreads.com/book/show/25815723-grudging
The Immortal Throne (The City, #2)	Stella Gemmell	4.02	451	https://www.goodreads.com/book/show/23346341-the-immortal-throne
The Shadow Revolution (Crown & Key, #1)	Clay Griffith	3.51	1,763	https://www.goodreads.com/book/show/22926502-the-shadow-revolution
Das Schloss der Träumenden Bücher (Zamonien, #11)	Walter Moers	4.33	161	https://www.goodreads.com/book/show/17696669-das-schloss-der-tr-umenden-b-cher
The Shifter Dimension (Starbirth, #2)	J.M. Johnson	4.57	104	https://www.goodreads.com/book/show/16079583-the-shifter-dimension
The Storyspinner (The Keepers' Chronicles, #1)	Becky Wallace	3.84	4,501	https://www.goodreads.com/book/show/18488433-the-storyspinner
The Undying Legion (Crown & Key, #2)	Clay Griffith	3.81	788	https://www.goodreads.com/book/show/23308133-the-undying-legion
The Long Utopia (The Long Earth #4)	Terry Pratchett	3.89	9,346	https://www.goodreads.com/book/show/23213813-the-long-utopia
Lords of the Sith	Paul S. Kemp	3.78	14,316	https://www.goodreads.com/book/show/22543835-lords-of-the-sith
The Rebirths of Tao (Tao, #3)	Wesley Chu	4.06	2,237	https://www.goodreads.com/book/show/20765775-the-rebirths-of-tao
The Mime Order (The Bone Season, #2)	Samantha Shannon	4.20	23,645	https://www.goodreads.com/book/show/17901125-the-mime-order
Chains of the Heretic (Bloodsounder's Arc, #3)	Jeff Salyards	4.05	880	https://www.goodreads.com/book/show/25159315-chains-of-the-heretic
Something Coming Through (The Choice, #1)	Paul McAuley	3.58	1,207	https://www.goodreads.com/book/show/23293706-something-coming-through
Saint's Blood (Greatcoats, #3)	Sebastien de Castell	4.26	7,738	https://www.goodreads.com/book/show/23899193-saint-s-blood
The Labyrinth of Flame (Shattered Sigil, #3)	Courtney Schafer	4.05	374	https://www.goodreads.com/book/show/18520619-the-labyrinth-of-flame
Chapelwood (The Borden Dispatches, #2)	Cherie Priest	3.78	1,031	https://www.goodreads.com/book/show/24611470-chapelwood
Words of Radiance (The Stormlight Archive, #2)	Brandon Sanderson	4.73	251,538	https://www.goodreads.com/book/show/17332218-words-of-radiance
The Name of the Wind (The Kingkiller Chronicle, #1)	Patrick Rothfuss	4.51	806,592	https://www.goodreads.com/book/show/186074.The_Name_of_the_Wind
The Empress Game (The Empress Game Trilogy #1)	Rhonda Mason	3.73	1,125	https://www.goodreads.com/book/show/23395806-the-empress-game
Haunted Tree (The Magus Family Chronicles, #1)	Scott Robert Scheller	3.79	89	https://www.goodreads.com/book/show/25272670-haunted-tree
Fire Starter (Fluorescence, #1)	P. Anastasia	3.56	333	https://www.goodreads.com/book/show/23842767-fire-starter
Blood Will Follow (The Valhalla Saga, #2)	Snorri Kristjansson	3.81	269	https://www.goodreads.com/book/show/20504287-blood-will-follow
Samara's Peril (Ilyon Chronicles, #3)	Jaye L. Knight	4.57	472	https://www.goodreads.com/book/show/29416663-samara-s-peril
Jimmy's Erotic Adventure in Time and Space Continuum (Episode 1)	Perie Wolford	4.03	179	https://www.goodreads.com/book/show/26336951-jimmy-s-erotic-adventure-in-time-and-space-continuum
Half-Blood (Ilyon Chronicles #0.5)	Jaye L. Knight	4.46	400	https://www.goodreads.com/book/show/25740919-half-blood
Lieutenant Henry Gallant (The Henry Gallant Saga Book 2)	H. Peter Alesso	4.00	595	https://www.goodreads.com/book/show/23172851-lieutenant-henry-gallant
The Boy Who Knew Everything (Piper McCloud, #2)	Victoria Forester	4.16	1,654	https://www.goodreads.com/book/show/23310670-the-boy-who-knew-everything
Sound (Salvage #2)	Alexandra Duncan	3.75	385	https://www.goodreads.com/book/show/24202895-sound
The Novice (Summoner, #1)	Taran Matharu	4.12	27,424	https://www.goodreads.com/book/show/22297138-the-novice
Please Don't Tell My Parents I Blew Up The Moon (Please Don't Tell My Parents, #2)	Richard Roberts	3.88	1,919	https://www.goodreads.com/book/show/23894061-please-don-t-tell-my-parents-i-blew-up-the-moon
Cold Iron (The Malorum Gates #1)	Stina Leicht	3.60	470	https://www.goodreads.com/book/show/23309742-cold-iron
In The Seraphim City	Eirik Moe Dahll-Larssøn	3.93	15	https://www.goodreads.com/book/show/25772034-in-the-seraphim-city
The Cage (The Cage, #1)	Megan Shepherd	3.66	6,388	https://www.goodreads.com/book/show/16071187-the-cage
Michael Hanson and the Desolate Woods (Powers of Ezron, #1)	E.L. Ervin	4.23	43	https://www.goodreads.com/book/show/24874510-michael-hanson-and-the-desolate-woods
The Thorn of Dentonhill (Maradaine, #1)	Marshall Ryan Maresca	3.81	916	https://www.goodreads.com/book/show/22668755-the-thorn-of-dentonhill
The Conquering Dark (Crown & Key, #3)	Clay Griffith	3.93	612	https://www.goodreads.com/book/show/23490954-the-conquering-dark
The Boy who Wept Blood (Erebus Sequence, #2)	Den Patrick	3.81	251	https://www.goodreads.com/book/show/23524820-the-boy-who-wept-blood
The Color of Vengeance (The Ties That Bind, #2)	Rob J. Hayes	4.10	1,388	https://www.goodreads.com/book/show/17913848-the-color-of-vengeance
Dragon in Exile (Liaden Universe, #18)	Sharon Lee	4.33	1,352	https://www.goodreads.com/book/show/23492519-dragon-in-exile
Deathblade (Darkblade #6)	C.L. Werner	3.65	148	https://www.goodreads.com/book/show/22609505-deathblade
The Girl with Ghost Eyes	M.H. Boroson	3.87	3,765	https://www.goodreads.com/book/show/25159239-the-girl-with-ghost-eyes
The Devil's Dreamcatcher (The Devil's, #2)	Donna Hosie	4.07	341	https://www.goodreads.com/book/show/21948626-the-devil-s-dreamcatcher
Blood Song (Raven's Shadow, #1)	Anthony Ryan	4.37	81,700	https://www.goodreads.com/book/show/13569581-blood-song
Tower Lord (Raven's Shadow, #2)	Anthony Ryan	4.17	43,106	https://www.goodreads.com/book/show/18138189-tower-lord
