title	author	ave_rating	no_rating	link
The Thousand Names (The Shadow Campaigns, #1)	Django Wexler	4.05	17,319	https://www.goodreads.com/book/show/15810910-the-thousand-names
Malice (The Faithful and the Fallen, #1)	John Gwynne	4.14	21,278	https://www.goodreads.com/book/show/15750692-malice
The Red Knight (The Traitor Son Cycle, #1)	Miles Cameron	4.11	15,870	https://www.goodreads.com/book/show/13616278-the-red-knight
Traitor's Blade (Greatcoats, #1)	Sebastien de Castell	4.05	19,267	https://www.goodreads.com/book/show/18947303-traitor-s-blade
Worm (Parahumans, #1)	Wildbow	4.62	7,107	https://www.goodreads.com/book/show/18713259-worm
The Crown Tower (The Riyria Chronicles, #1)	Michael J. Sullivan	4.34	32,943	https://www.goodreads.com/book/show/16043804-the-crown-tower
The Last Wish (The Witcher, #0.5)	Andrzej Sapkowski	4.12	245,658	https://www.goodreads.com/book/show/1128434.The_Last_Wish
The Cloud Roads (Books of the Raksura, #1)	Martha Wells	3.97	9,567	https://www.goodreads.com/book/show/9461562-the-cloud-roads
Heroes Die (The Acts of Caine, #1)	Matthew Woodring Stover	4.09	11,398	https://www.goodreads.com/book/show/311864.Heroes_Die
House of Blades (Traveler's Gate, #1)	Will Wight	4.06	13,577	https://www.goodreads.com/book/show/18047306-house-of-blades
The Spirit Thief (The Legend of Eli Monpress, #1)	Rachel Aaron	3.88	9,353	https://www.goodreads.com/book/show/8097637-the-spirit-thief
Retribution Falls (Tales of the Ketty Jay, #1)	Chris Wooding	3.97	9,193	https://www.goodreads.com/book/show/6285903-retribution-falls
The Emperor's Edge (The Emperor's Edge, #1)	Lindsay Buroker	4.04	13,623	https://www.goodreads.com/book/show/10031259-the-emperor-s-edge
Daughter of Smoke & Bone (Daughter of Smoke & Bone, #1)	Laini Taylor	3.98	352,453	https://www.goodreads.com/book/show/8490112-daughter-of-smoke-bone
The Black Company (The Chronicles of the Black Company, #1)	Glen Cook	3.90	48,014	https://www.goodreads.com/book/show/140671.The_Black_Company
The Curse of Chalion (World of the Five Gods, #1)	Lois McMaster Bujold	4.10	39,539	https://www.goodreads.com/book/show/61886.The_Curse_of_Chalion
The Killing Moon (Dreamblood, #1)	N.K. Jemisin	3.93	15,702	https://www.goodreads.com/book/show/11774272-the-killing-moon
Scourge of the Betrayer (Bloodsounder's Arc, #1)	Jeff Salyards	3.52	2,765	https://www.goodreads.com/book/show/13279692-scourge-of-the-betrayer
Bridge of Birds (The Chronicles of Master Li and Number Ten Ox, #1)	Barry Hughart	4.28	9,865	https://www.goodreads.com/book/show/15177.Bridge_of_Birds
Low Town (Low Town, #1)	Daniel Polansky	3.85	5,711	https://www.goodreads.com/book/show/9755449-low-town
The Bone Doll's Twin (The Tamír Triad, #1)	Lynn Flewelling	4.06	11,982	https://www.goodreads.com/book/show/671560.The_Bone_Doll_s_Twin
The Privilege of the Sword (Riverside, #2)	Ellen Kushner	3.92	5,036	https://www.goodreads.com/book/show/821583.The_Privilege_of_the_Sword
A Cavern of Black Ice (Sword of Shadows, #1)	J.V. Jones	3.87	8,867	https://www.goodreads.com/book/show/24249.A_Cavern_of_Black_Ice
Empire in Black and Gold (Shadows of the Apt, #1)	Adrian Tchaikovsky	3.69	9,062	https://www.goodreads.com/book/show/3437309-empire-in-black-and-gold
Luck in the Shadows (Nightrunner, #1)	Lynn Flewelling	4.08	19,576	https://www.goodreads.com/book/show/74270.Luck_in_the_Shadows
A Natural History of Dragons (The Memoirs of Lady Trent, #1)	Marie Brennan	3.81	31,872	https://www.goodreads.com/book/show/12974372-a-natural-history-of-dragons
The Riddle-Master of Hed (Riddle-Master, #1)	Patricia A. McKillip	4.00	11,937	https://www.goodreads.com/book/show/92755.The_Riddle_Master_of_Hed
Transformation (Rai-Kirah, #1)	Carol Berg	3.99	6,983	https://www.goodreads.com/book/show/618196.Transformation
Three Parts Dead (Craft Sequence, #1)	Max Gladstone	3.97	13,126	https://www.goodreads.com/book/show/13539191-three-parts-dead
The Hundred Thousand Kingdoms (Inheritance, #1)	N.K. Jemisin	3.87	66,395	https://www.goodreads.com/book/show/6437061-the-hundred-thousand-kingdoms
Mage's Blood (Moontide Quartet, #1)	David Hair	3.87	4,413	https://www.goodreads.com/book/show/15771846-mage-s-blood
Promise of Blood (Powder Mage, #1)	Brian McClellan	4.10	50,855	https://www.goodreads.com/book/show/15790883-promise-of-blood
Dragon Fate (War of the Blades, #1)	J.D. Hallowell	3.83	733	https://www.goodreads.com/book/show/15829015-dragon-fate
A Dance of Cloaks (Shadowdance, #1)	David Dalglish	3.75	12,370	https://www.goodreads.com/book/show/9601799-a-dance-of-cloaks
The Time of the Dark (Darwath, #1)	Barbara Hambly	3.98	5,159	https://www.goodreads.com/book/show/176277.The_Time_of_the_Dark
Range of Ghosts (Eternal Sky, #1)	Elizabeth Bear	3.69	3,727	https://www.goodreads.com/book/show/12109372-range-of-ghosts
The Dying Earth (The Dying Earth #1)	Jack Vance	3.92	8,077	https://www.goodreads.com/book/show/951749.The_Dying_Earth
The Grim Company (The Grim Company, #1)	Luke Scull	3.73	6,866	https://www.goodreads.com/book/show/17707471-the-grim-company
Daughter of the Empire (The Empire Trilogy, #1)	Raymond E. Feist	4.28	34,433	https://www.goodreads.com/book/show/589979.Daughter_of_the_Empire
The Steel Remains (A Land Fit for Heroes, #1)	Richard K. Morgan	3.74	15,500	https://www.goodreads.com/book/show/3314369-the-steel-remains
The Dragon's Path (The Dagger and the Coin, #1)	Daniel Abraham	3.79	19,580	https://www.goodreads.com/book/show/8752885-the-dragon-s-path
The Whitefire Crossing (Shattered Sigil, #1)	Courtney Schafer	3.71	2,386	https://www.goodreads.com/book/show/10928630-the-whitefire-crossing
A Shadow in Summer (Long Price Quartet, #1)	Daniel Abraham	3.62	11,838	https://www.goodreads.com/book/show/208.A_Shadow_in_Summer
City of Stairs (The Divine Cities, #1)	Robert Jackson Bennett	4.04	34,042	https://www.goodreads.com/book/show/20174424-city-of-stairs
Sword-Dancer (Tiger and Del, #1)	Jennifer Roberson	3.99	7,755	https://www.goodreads.com/book/show/127645.Sword_Dancer
A Crucible of Souls (Sorcery Ascendant Sequence, #1)	Mitchell Hogan	3.94	7,491	https://www.goodreads.com/book/show/18241129-a-crucible-of-souls
Control Point (Shadow Ops, #1)	Myke Cole	3.50	6,414	https://www.goodreads.com/book/show/11783484-control-point
Among Thieves (Tales of the Kin, #1)	Douglas Hulick	3.94	12,311	https://www.goodreads.com/book/show/8801543-among-thieves
Spirit Gate (Crossroads, #1)	Kate Elliott	3.59	3,794	https://www.goodreads.com/book/show/210197.Spirit_Gate
Cold Magic (Spiritwalker, #1)	Kate Elliott	3.72	8,857	https://www.goodreads.com/book/show/7114825-cold-magic
Inda (Inda, #1)	Sherwood Smith	4.01	4,454	https://www.goodreads.com/book/show/222837.Inda
The Sword of Truth (The Godling Chronicles, #1)	Brian D. Anderson	3.84	3,164	https://www.goodreads.com/book/show/15804084-the-sword-of-truth
The Last Stormlord (Watergivers, #1)	Glenda Larke	3.76	6,904	https://www.goodreads.com/book/show/6765788-the-last-stormlord
The Steerswoman (The Steerswoman, #1)	Rosemary Kirstein	4.00	2,592	https://www.goodreads.com/book/show/793297.The_Steerswoman
Lord of the Silver Bow (Troy, #1)	David Gemmell	4.33	13,368	https://www.goodreads.com/book/show/257149.Lord_of_the_Silver_Bow
Deryni Rising (The Chronicles of the Deryni #1)	Katherine Kurtz	3.95	7,152	https://www.goodreads.com/book/show/537124.Deryni_Rising
Jhereg (Vlad Taltos, #1)	Steven Brust	4.13	14,178	https://www.goodreads.com/book/show/133454.Jhereg
Lord Valentine's Castle (Lord Valentine, #1)	Robert Silverberg	3.89	9,006	https://www.goodreads.com/book/show/252838.Lord_Valentine_s_Castle
Unsouled (Cradle, #1)	Will Wight	4.15	23,606	https://www.goodreads.com/book/show/30558257-unsouled
God Stalk (Kencyrath, #1)	P.C. Hodgell	4.11	2,312	https://www.goodreads.com/book/show/69169.God_Stalk
The Red Wolf Conspiracy (The Chathrand Voyage, #1)	Robert V.S. Redick	3.69	6,114	https://www.goodreads.com/book/show/2408602.The_Red_Wolf_Conspiracy
In the Night Garden (The Orphan's Tales, #1)	Catherynne M. Valente	3.86	11,866	https://www.goodreads.com/book/show/202769.In_the_Night_Garden
Thieves' World (Thieves' World, #1)	Robert Lynn Asprin	3.84	7,502	https://www.goodreads.com/book/show/552357.Thieves_World
The Curse of the Mistwraith (Wars of Light and Shadow, #1)	Janny Wurts	3.76	5,346	https://www.goodreads.com/book/show/28660.The_Curse_of_the_Mistwraith
City of Golden Shadow (Otherland, #1)	Tad Williams	3.92	27,567	https://www.goodreads.com/book/show/28695.City_of_Golden_Shadow
Theft of Swords (The Riyria Revelations, #1-2)	Michael J. Sullivan	4.18	63,619	https://www.goodreads.com/book/show/10790290-theft-of-swords
The Lives of Tao (Tao, #1)	Wesley Chu	3.75	8,193	https://www.goodreads.com/book/show/15981711-the-lives-of-tao
Elven Jewel	Kasper Beaumont	4.16	92	https://www.goodreads.com/book/show/18306338-elven-jewel
Throne of the Crescent Moon (The Crescent Moon Kingdoms, #1)	Saladin Ahmed	3.64	10,754	https://www.goodreads.com/book/show/11487807-throne-of-the-crescent-moon
The Death of the Necromancer (Ile-Rien, #2)	Martha Wells	4.05	3,418	https://www.goodreads.com/book/show/321357.The_Death_of_the_Necromancer
The Emperor's Knife (Tower and Knife Trilogy, #1)	Mazarkis Williams	3.30	2,000	https://www.goodreads.com/book/show/11285675-the-emperor-s-knife
The Hammer and the Blade (Egil and Nix, #1)	Paul S. Kemp	3.75	1,991	https://www.goodreads.com/book/show/12987245-the-hammer-and-the-blade
Blood Song (Raven's Shadow, #1)	Anthony Ryan	4.37	81,699	https://www.goodreads.com/book/show/13569581-blood-song
The Many-Coloured Land (Saga of Pliocene Exile, #1)	Julian May	4.07	11,902	https://www.goodreads.com/book/show/378639.The_Many_Coloured_Land
Riddle in Stone (The Riddle in Stone, #1)	Robert Evert	3.94	723	https://www.goodreads.com/book/show/17339738-riddle-in-stone
Lyonesse (Lyonesse #1)	Jack Vance	3.93	5,211	https://www.goodreads.com/book/show/19284741-lyonesse
The Scar	Marina Dyachenko	3.92	1,348	https://www.goodreads.com/book/show/12074910-the-scar
Calastan	Cheryllynn Dyess	3.97	31	https://www.goodreads.com/book/show/22360953-calastan
Od Magic	Patricia A. McKillip	3.99	3,807	https://www.goodreads.com/book/show/19823.Od_Magic
A Secret History (Book of Ash, #1)	Mary Gentle	3.64	751	https://www.goodreads.com/book/show/445023.A_Secret_History
The Ten Thousand (The Macht #1)	Paul Kearney	3.80	3,564	https://www.goodreads.com/book/show/3391271-the-ten-thousand
Blue Moon Rising (Forest Kingdom, #1)	Simon R. Green	4.08	4,413	https://www.goodreads.com/book/show/810881.Blue_Moon_Rising
Shadow's Son (Shadow Saga, #1)	Jon Sprunk	3.58	4,410	https://www.goodreads.com/book/show/6951425-shadow-s-son
The Broken Sword	Poul Anderson	3.86	5,836	https://www.goodreads.com/book/show/715287.The_Broken_Sword
Alphabet of Thorn	Patricia A. McKillip	4.08	5,500	https://www.goodreads.com/book/show/81075.Alphabet_of_Thorn
The Gone-Away World	Nick Harkaway	4.11	12,113	https://www.goodreads.com/book/show/3007704-the-gone-away-world
The First Book of Lankhmar (Fafhrd and the Gray Mouser, #1-4)	Fritz Leiber	4.11	1,971	https://www.goodreads.com/book/show/102283.The_First_Book_of_Lankhmar
The Folding Knife	K.J. Parker	3.94	2,747	https://www.goodreads.com/book/show/6616466-the-folding-knife
Tam Lin	Pamela Dean	3.85	5,592	https://www.goodreads.com/book/show/51106.Tam_Lin
Fortress in the Eye of Time (Fortress, #1)	C.J. Cherryh	3.87	3,833	https://www.goodreads.com/book/show/57017.Fortress_in_the_Eye_of_Time
Awakening (The Ydron Saga #1)	Raymond Bolton	4.24	67	https://www.goodreads.com/book/show/20257287-awakening
Fire and Hemlock	Diana Wynne Jones	3.97	9,774	https://www.goodreads.com/book/show/367158.Fire_and_Hemlock
Those Who Hunt the Night (James Asher #1)	Barbara Hambly	3.85	4,425	https://www.goodreads.com/book/show/176261.Those_Who_Hunt_the_Night
Shadow Moon (Chronicles of the Shadow War, #1)	George Lucas	3.30	2,109	https://www.goodreads.com/book/show/160859.Shadow_Moon
The Anvil of the World (Lord Ermenwyr, #1)	Kage Baker	3.88	1,952	https://www.goodreads.com/book/show/297815.The_Anvil_of_the_World
Rough Magick (GnomeSaga #1)	Kenny Soward	3.89	218	https://www.goodreads.com/book/show/21821838-rough-magick
Riddle-Master (Riddle-Master, #1-3)	Patricia A. McKillip	4.22	10,455	https://www.goodreads.com/book/show/19821.Riddle_Master
Mélusine (Doctrine of Labyrinths, #1)	Sarah Monette	3.64	4,107	https://www.goodreads.com/book/show/492069.M_lusine
Mythago Wood (Mythago Wood, #1)	Robert Holdstock	3.80	9,044	https://www.goodreads.com/book/show/126192.Mythago_Wood
Annihilation	Jeff VanderMeer	3.73	177,110	https://www.goodreads.com/book/show/17934530-annihilation
Dark Lord of Derkholm (Derkholm, #1)	Diana Wynne Jones	4.12	15,502	https://www.goodreads.com/book/show/47587.Dark_Lord_of_Derkholm
Miserere: An Autumn Tale	T. Frohock	3.78	1,011	https://www.goodreads.com/book/show/10193060-miserere
The Savage Tales of Solomon Kane	Robert E. Howard	4.06	4,797	https://www.goodreads.com/book/show/363711.The_Savage_Tales_of_Solomon_Kane
The Ladies of Mandrigyn (Sun Wolf and Starhawk, #1)	Barbara Hambly	3.96	3,133	https://www.goodreads.com/book/show/1022658.The_Ladies_of_Mandrigyn
The Gate of Ivory (Ivory #1)	Doris Egan	3.96	814	https://www.goodreads.com/book/show/884583.The_Gate_of_Ivory
The Garden of Stones (Echoes of Empire, #1)	Mark T. Barnes	3.63	1,083	https://www.goodreads.com/book/show/17046606-the-garden-of-stones
First Rider's Call (Green Rider, #2)	Kristen Britain	4.22	21,635	https://www.goodreads.com/book/show/147844.First_Rider_s_Call
Who Fears Death (Who Fears Death, #1)	Nnedi Okorafor	3.96	20,891	https://www.goodreads.com/book/show/7767021-who-fears-death
As the Crow Flies	Robin Lythgoe	4.06	130	https://www.goodreads.com/book/show/17926176-as-the-crow-flies
Blood of Elves (The Witcher, #1)	Andrzej Sapkowski	4.09	140,428	https://www.goodreads.com/book/show/6043781-blood-of-elves
The Initiate (Time Master, #1)	Louise Cooper	4.04	1,938	https://www.goodreads.com/book/show/1253331.The_Initiate
The Devil You Know (Felix Castor, #1)	Mike Carey	3.80	15,829	https://www.goodreads.com/book/show/663098.The_Devil_You_Know
Shadowmarch (Shadowmarch, #1)	Tad Williams	3.74	11,588	https://www.goodreads.com/book/show/28694.Shadowmarch
First Chosen (Tears of Rage, #1)	M. Todd Gallowglas	3.73	277	https://www.goodreads.com/book/show/11717080-first-chosen
Deathless	Catherynne M. Valente	3.99	17,521	https://www.goodreads.com/book/show/8694389-deathless
Titus Groan (Gormenghast, #1)	Mervyn Peake	3.91	17,136	https://www.goodreads.com/book/show/39063.Titus_Groan
The Jackal of Nar (Tyrants and Kings, #1)	John Marco	3.59	2,089	https://www.goodreads.com/book/show/908330.The_Jackal_of_Nar
The Silent Tower (Windrose Chronicles, #1)	Barbara Hambly	3.94	3,314	https://www.goodreads.com/book/show/176308.The_Silent_Tower
Nights of Villjamur (Legends of the Red Sun, #1)	Mark Charan Newton	3.28	2,138	https://www.goodreads.com/book/show/6900601-nights-of-villjamur
Magic Lost, Trouble Found (Raine Benares #1)	Lisa Shearin	3.74	7,200	https://www.goodreads.com/book/show/621697.Magic_Lost_Trouble_Found
The Morgaine Saga (Morgaine & Vanye, #1-3)	C.J. Cherryh	4.10	1,740	https://www.goodreads.com/book/show/57040.The_Morgaine_Saga
God's War (Bel Dame Apocrypha, #1)	Kameron Hurley	3.66	4,806	https://www.goodreads.com/book/show/9359818-god-s-war
Firehurler (Twinborn Trilogy, #1)	J.S. Morin	3.97	777	https://www.goodreads.com/book/show/17408269-firehurler
Dragonsbane (Winterlands #1)	Barbara Hambly	3.95	6,517	https://www.goodreads.com/book/show/176268.Dragonsbane
Havenstar	Glenda Larke	4.14	289	https://www.goodreads.com/book/show/2272159.Havenstar
The Half-Made World (The Half-Made World, #1)	Felix Gilman	3.75	3,873	https://www.goodreads.com/book/show/8198773-the-half-made-world
Through the Barrier (Princes and Priests #1; Novels of Shannon #1)	Angela MacDonald	4.50	24	https://www.goodreads.com/book/show/17339618-through-the-barrier
Witch World (Witch World Series 1: Estcarp Cycle, #1)	Andre Norton	3.82	4,490	https://www.goodreads.com/book/show/462448.Witch_World
The Changeling Sea	Patricia A. McKillip	4.07	5,221	https://www.goodreads.com/book/show/59.The_Changeling_Sea
Revelations (Princes and Priests #3; Novels of Shannon #3)	Angela MacDonald	4.67	12	https://www.goodreads.com/book/show/17339698-revelations
The Drawing of the Dark	Tim Powers	3.92	4,675	https://www.goodreads.com/book/show/209693.The_Drawing_of_the_Dark
Dämoren (Valducan, #1)	Seth Skorkowsky	3.91	1,145	https://www.goodreads.com/book/show/21902617-d-moren
Sea Change	S.M. Wheeler	3.49	437	https://www.goodreads.com/book/show/16059409-sea-change
The King of Elfland's Daughter	Lord Dunsany	3.83	6,549	https://www.goodreads.com/book/show/14686.The_King_of_Elfland_s_Daughter
Free the Darkness (King's Dark Tidings #1)	Kel Kade	4.23	17,798	https://www.goodreads.com/book/show/28385685-free-the-darkness
Spellwright (Spellwright, #1)	Blake Charlton	3.60	4,426	https://www.goodreads.com/book/show/6703145-spellwright
The Darkangel (Darkangel Trilogy, #1)	Meredith Ann Pierce	3.90	9,060	https://www.goodreads.com/book/show/92717.The_Darkangel
The Child Thief	Brom	4.09	15,495	https://www.goodreads.com/book/show/8173470-the-child-thief
Garrett, P.I.	Glen Cook	4.26	467	https://www.goodreads.com/book/show/140665.Garrett_P_I_
Finnikin of the Rock (Lumatere Chronicles, #1)	Melina Marchetta	3.86	50,448	https://www.goodreads.com/book/show/4932435-finnikin-of-the-rock
The Immortal Prince (Tide Lords, #1)	Jennifer Fallon	3.97	4,108	https://www.goodreads.com/book/show/2038926.The_Immortal_Prince
Dragon Champion (Age of Fire #1)	E.E. Knight	3.98	5,685	https://www.goodreads.com/book/show/632579.Dragon_Champion
Armageddon's Children (Genesis of Shannara, #1)	Terry Brooks	4.11	15,881	https://www.goodreads.com/book/show/15549.Armageddon_s_Children
The Library at Mount Char	Scott Hawkins	4.09	38,276	https://www.goodreads.com/book/show/26892110-the-library-at-mount-char
The Fell Sword (The Traitor Son Cycle, #2)	Miles Cameron	4.25	9,259	https://www.goodreads.com/book/show/17737893-the-fell-sword
The Broken Crown (The Sun Sword, #1)	Michelle West	3.93	2,995	https://www.goodreads.com/book/show/153220.The_Broken_Crown
Harry Potter and the Methods of Rationality	Eliezer Yudkowsky	4.39	14,911	https://www.goodreads.com/book/show/10016013-harry-potter-and-the-methods-of-rationality
The Perilous Gard	Elizabeth Marie Pope	4.09	8,423	https://www.goodreads.com/book/show/831580.The_Perilous_Gard
The Etched City	K.J. Bishop	3.66	2,543	https://www.goodreads.com/book/show/944555.The_Etched_City
Between Two Fires	Christopher Buehlman	4.18	3,761	https://www.goodreads.com/book/show/13543121-between-two-fires
The Bone Key: The Necromantic Mysteries of Kyle Murchison Booth	Sarah Monette	4.10	1,338	https://www.goodreads.com/book/show/219813.The_Bone_Key
The Barbed Coil	J.V. Jones	3.91	2,471	https://www.goodreads.com/book/show/29135.The_Barbed_Coil
The Four Realms	Adrian Faulkner	3.76	33	https://www.goodreads.com/book/show/16281762-the-four-realms
Against All Odds (Princes and Priests #2; Novels of Shannon #2)	Angela MacDonald	4.67	12	https://www.goodreads.com/book/show/17339663-against-all-odds
Poison Study (Study, #1)	Maria V. Snyder	4.07	163,744	https://www.goodreads.com/book/show/60510.Poison_Study
Flora Segunda (Flora Trilogy #1)	Ysabeau S. Wilce	3.69	4,307	https://www.goodreads.com/book/show/229033.Flora_Segunda
The Dirty Streets of Heaven (Bobby Dollar, #1)	Tad Williams	3.73	8,794	https://www.goodreads.com/book/show/13542846-the-dirty-streets-of-heaven
Stories of Your Life and Others	Ted Chiang	4.22	81,642	https://www.goodreads.com/book/show/223380.Stories_of_Your_Life_and_Others
Moon's Artifice (The Empire of a Hundred Houses, #1)	Tom Lloyd	3.67	409	https://www.goodreads.com/book/show/18664972-moon-s-artifice
Thread Slivers	Leeland Artra	4.00	652	https://www.goodreads.com/book/show/17306681-thread-slivers
Stained Glass Monsters (Eferum, #1)	Andrea K. Höst	3.98	428	https://www.goodreads.com/book/show/10518066-stained-glass-monsters
The Sword-Edged Blonde (Eddie LaCrosse, #1)	Alex Bledsoe	3.78	2,507	https://www.goodreads.com/book/show/1354323.The_Sword_Edged_Blonde
No Return (Jeroun, #1)	Zachary Jernigan	3.62	426	https://www.goodreads.com/book/show/15817069-no-return
Sharps	K.J. Parker	3.87	1,459	https://www.goodreads.com/book/show/12826714-sharps
The Alchemist of Souls (Night's Masque, #1)	Anne Lyle	3.46	1,644	https://www.goodreads.com/book/show/11515333-the-alchemist-of-souls
Sworn in Steel (Tales of the Kin, #2)	Douglas Hulick	4.21	5,195	https://www.goodreads.com/book/show/12395241-sworn-in-steel
The Heresy Within (The Ties That Bind, #1)	Rob J. Hayes	3.89	2,550	https://www.goodreads.com/book/show/17879131-the-heresy-within
Flesh and Spirit (Lighthouse, #1)	Carol Berg	3.88	3,265	https://www.goodreads.com/book/show/437790.Flesh_and_Spirit
The Anvil of Ice (The Winter of the World, #1)	Michael Scott Rohan	3.95	1,219	https://www.goodreads.com/book/show/285746.The_Anvil_of_Ice
Winterbirth (The Godless World, #1)	Brian Ruckley	3.38	3,227	https://www.goodreads.com/book/show/1462020.Winterbirth
Rivers of London: Body Work, #1	Ben Aaronovitch	3.86	2,890	https://www.goodreads.com/book/show/23387877-rivers-of-london
Halloween Jack and the Devil's Gate	M. Todd Gallowglas	3.91	158	https://www.goodreads.com/book/show/18660759-halloween-jack-and-the-devil-s-gate
The Hammer and the Cross (Hammer and the Cross, #1)	Harry Harrison	4.02	1,229	https://www.goodreads.com/book/show/710830.The_Hammer_and_the_Cross
Havemercy (Havemercy #1)	Jaida Jones	3.62	2,692	https://www.goodreads.com/book/show/2305862.Havemercy
Lud-in-the-Mist	Hope Mirrlees	3.87	5,933	https://www.goodreads.com/book/show/73574.Lud_in_the_Mist
The Book of Atrix Wolfe	Patricia A. McKillip	3.98	3,709	https://www.goodreads.com/book/show/77353.The_Book_of_Atrix_Wolfe
The House of the Stag (Lord Ermenwyr, #2)	Kage Baker	3.94	847	https://www.goodreads.com/book/show/3213520-the-house-of-the-stag
Trollslayer (Gotrek & Felix #1)	William King	3.97	3,658	https://www.goodreads.com/book/show/691915.Trollslayer
Bitter Seeds (The Milkweed Triptych, #1)	Ian Tregillis	3.74	6,494	https://www.goodreads.com/book/show/6881685-bitter-seeds
The Black God's War (Splendor and Ruin, #0.5)	Moses Siregar III	3.56	540	https://www.goodreads.com/book/show/12361115-the-black-god-s-war
Stray (Touchstone, #1)	Andrea K. Höst	3.99	3,692	https://www.goodreads.com/book/show/10837174-stray
Child of the Sword (The Gods Within, #1)	J.L. Doty	3.78	1,075	https://www.goodreads.com/book/show/16037931-child-of-the-sword
Banewreaker (The Sundering, #1)	Jacqueline Carey	3.46	4,333	https://www.goodreads.com/book/show/40222.Banewreaker
The Drowning Girl	Caitlín R. Kiernan	3.71	4,770	https://www.goodreads.com/book/show/11515328-the-drowning-girl
Guards! Guards! (Discworld, #8; City Watch #1)	Terry Pratchett	4.28	185,483	https://www.goodreads.com/book/show/64216.Guards_Guards_
Winter Rose (Winter Rose, #1)	Patricia A. McKillip	3.85	7,079	https://www.goodreads.com/book/show/77364.Winter_Rose
Song of the Beast	Carol Berg	4.04	2,334	https://www.goodreads.com/book/show/437788.Song_of_the_Beast
The Twelve Kingdoms: Sea of Shadow (The Twelve Kingdoms, #1)	Fuyumi Ono	4.21	2,699	https://www.goodreads.com/book/show/13737.The_Twelve_Kingdoms
In Siege of Daylight (Compendium of Light, Dark & Shadow, #1)	Gregory S. Close	3.92	79	https://www.goodreads.com/book/show/17900556-in-siege-of-daylight
The City	Stella Gemmell	3.63	2,029	https://www.goodreads.com/book/show/15985344-the-city
Bazil Broketail (Bazil Broketail, #1)	Christopher Rowley	4.10	1,035	https://www.goodreads.com/book/show/363883.Bazil_Broketail
To Ride Hell’s Chasm	Janny Wurts	3.82	1,459	https://www.goodreads.com/book/show/1961496.To_Ride_Hell_s_Chasm
The Briar King (Kingdoms of Thorn and Bone, #1)	Greg Keyes	3.74	11,164	https://www.goodreads.com/book/show/91964.The_Briar_King
Three Hearts and Three Lions	Poul Anderson	3.87	4,363	https://www.goodreads.com/book/show/338329.Three_Hearts_and_Three_Lions
The Emperor's Blades (Chronicle of the Unhewn Throne, #1)	Brian Staveley	4.05	40,891	https://www.goodreads.com/book/show/17910124-the-emperor-s-blades
The Troupe	Robert Jackson Bennett	3.84	2,073	https://www.goodreads.com/book/show/11737656-the-troupe
The Court of the Air (Jackelian, #1)	Stephen Hunt	3.30	4,056	https://www.goodreads.com/book/show/837197.The_Court_of_the_Air
Hawkwood's Voyage (The Monarchies of God, #1)	Paul Kearney	3.76	1,807	https://www.goodreads.com/book/show/1251979.Hawkwood_s_Voyage
The Wood Wife	Terri Windling	4.20	3,283	https://www.goodreads.com/book/show/463024.The_Wood_Wife
Night's Master	Tanith Lee	4.04	2,390	https://www.goodreads.com/book/show/1207411.Night_s_Master
Farlander (Heart of the World, #1)	Col Buchanan	3.39	1,840	https://www.goodreads.com/book/show/8698731-farlander
Cygnet (Cygnet, #1-2)	Patricia A. McKillip	4.08	580	https://www.goodreads.com/book/show/19820.Cygnet
Troubled Waters (Elemental Blessings, #1)	Sharon Shinn	4.01	9,157	https://www.goodreads.com/book/show/9500500-troubled-waters
Age of Iron (Iron Age, #1)	Angus Watson	3.85	2,581	https://www.goodreads.com/book/show/22463760-age-of-iron
Thieftaker (Thieftaker Chronicles, #1)	D.B. Jackson	3.64	2,371	https://www.goodreads.com/book/show/11577576-thieftaker
Devlin's Luck (Sword of Change, #1)	Patricia Bray	3.81	1,401	https://www.goodreads.com/book/show/208740.Devlin_s_Luck
Lamentation (Psalms of Isaak, #1)	Ken Scholes	3.70	3,147	https://www.goodreads.com/book/show/3531469-lamentation
Master of the Five Magics (Magics, #1)	Lyndon Hardy	3.81	5,245	https://www.goodreads.com/book/show/1180618.Master_of_the_Five_Magics
The Stormcaller (Twilight Reign, #1)	Tom Lloyd	3.70	3,380	https://www.goodreads.com/book/show/1468912.The_Stormcaller
Railsea	China Miéville	3.90	12,045	https://www.goodreads.com/book/show/12392681-railsea
Latro in the Mist	Gene Wolfe	4.19	1,682	https://www.goodreads.com/book/show/344935.Latro_in_the_Mist
Dragon Prince (Dragon Prince, #1)	Melanie Rawn	3.95	15,564	https://www.goodreads.com/book/show/185289.Dragon_Prince
